,order,family,name,year,date1,datetime,individuals
0,LEPIDOPTERA,ACROLEPIIDAE,Acrolepiopsis assectella Zell.,1994,8/12/94,1994-08-21,1
1,LEPIDOPTERA,ACROLEPIIDAE,Acrolepiopsis assectella Zell.,1994,8/22/94,1994-08-25,1
2,LEPIDOPTERA,ACROLEPIIDAE,Acrolepiopsis assectella Zell.,1996,7/24/96,1996-07-25,1
3,LEPIDOPTERA,ACROLEPIIDAE,Acrolepiopsis assectella Zell.,1998,7/13/98,1998-07-19,1
4,LEPIDOPTERA,ACROLEPIIDAE,Acrolepiopsis assectella Zell.,1999,8/9/99,1999-08-10,1
5,LEPIDOPTERA,ACROLEPIIDAE,Acrolepiopsis assectella Zell.,1999,8/30/99,1999-08-31,1
6,LEPIDOPTERA,ACROLEPIIDAE,Acrolepiopsis assectella Zell.,2000,7/28/00,2000-07-30,1
7,LEPIDOPTERA,ACROLEPIIDAE,Acrolepiopsis assectella Zell.,2003,8/19/03,2003-08-28,1
8,LEPIDOPTERA,ACROLEPIIDAE,Acrolepiopsis assectella Zell.,2004,7/26/04,2004-07-27,1
9,LEPIDOPTERA,ACROLEPIIDAE,Acrolepiopsis assectella Zell.,2006,7/14/06,2006-07-20,1
10,LEPIDOPTERA,ACROLEPIIDAE,Acrolepiopsis assectella Zell.,2006,8/17/06,2006-08-24,1
11,LEPIDOPTERA,ADELIDAE,Nematopogon adansoniella Vill.,1993,4/22/93,1993-05-16,1
12,LEPIDOPTERA,ADELIDAE,Nematopogon adansoniella Vill.,1995,5/22/95,1995-05-31,4
13,LEPIDOPTERA,ADELIDAE,Nematopogon adansoniella Vill.,1996,6/13/96,1996-06-20,3
14,LEPIDOPTERA,ADELIDAE,Nematopogon adansoniella Vill.,1997,5/7/97,1997-05-29,7
15,LEPIDOPTERA,ADELIDAE,Nematopogon adansoniella Vill.,1997,5/30/97,1997-06-03,4
16,LEPIDOPTERA,ADELIDAE,Nematopogon adansoniella Vill.,1998,4/30/98,1998-05-06,1
17,LEPIDOPTERA,ADELIDAE,Nematopogon adansoniella Vill.,1998,5/14/98,1998-05-18,5
18,LEPIDOPTERA,ADELIDAE,Nematopogon adansoniella Vill.,1998,5/19/98,1998-05-26,1
19,LEPIDOPTERA,ADELIDAE,Nematopogon adansoniella Vill.,2000,5/11/00,2000-05-16,2
20,LEPIDOPTERA,ADELIDAE,Nematopogon adansoniella Vill.,2001,5/10/01,2001-05-21,2
21,LEPIDOPTERA,ADELIDAE,Nematopogon adansoniella Vill.,2001,5/22/01,2001-05-31,1
22,LEPIDOPTERA,ADELIDAE,Nematopogon adansoniella Vill.,2002,4/22/02,2002-05-12,1
23,LEPIDOPTERA,ADELIDAE,Nematopogon adansoniella Vill.,2002,5/13/02,2002-05-23,1
24,LEPIDOPTERA,ADELIDAE,Nematopogon adansoniella Vill.,2003,5/21/03,2003-05-26,1
25,LEPIDOPTERA,ADELIDAE,Nematopogon adansoniella Vill.,2004,5/6/04,2004-05-17,1
26,LEPIDOPTERA,ADELIDAE,Nematopogon adansoniella Vill.,2004,5/18/04,2004-06-07,1
27,LEPIDOPTERA,ADELIDAE,Nematopogon adansoniella Vill.,2005,4/11/05,2005-05-02,1
28,LEPIDOPTERA,ADELIDAE,Nematopogon adansoniella Vill.,2005,5/25/05,2005-05-29,1
29,LEPIDOPTERA,ADELIDAE,Nematopogon adansoniella Vill.,2007,4/2/07,2007-04-29,1
30,LEPIDOPTERA,ADELIDAE,Nematopogon adansoniella Vill.,2007,4/30/07,2007-05-14,1
31,LEPIDOPTERA,ADELIDAE,Nematopogon adansoniella Vill.,2007,5/15/07,2007-05-21,2
32,LEPIDOPTERA,ADELIDAE,Nematopogon adansoniella Vill.,2008,4/25/08,2008-05-05,2
33,LEPIDOPTERA,ADELIDAE,Nematopogon adansoniella Vill.,2009,4/24/09,2009-05-06,1
34,LEPIDOPTERA,ADELIDAE,Nematopogon adansoniella Vill.,2009,5/20/09,2009-06-02,1
35,LEPIDOPTERA,ADELIDAE,Nematopogon robertella Cl.,1995,6/20/95,1995-06-25,1
36,LEPIDOPTERA,ADELIDAE,Nematopogon robertella Cl.,2001,6/25/01,2001-06-27,2
37,LEPIDOPTERA,ADELIDAE,Nematopogon robertella Cl.,2004,6/8/04,2004-06-10,1
38,LEPIDOPTERA,ADELIDAE,Nematopogon robertella Cl.,2006,6/14/06,2006-06-20,1
39,LEPIDOPTERA,ADELIDAE,Nematopogon robertella Cl.,2008,6/3/08,2008-06-08,1
40,LEPIDOPTERA,AGONOXENIDAE,Blastodacna atra Hw.,1992,6/24/92,1992-06-25,3
41,LEPIDOPTERA,AGONOXENIDAE,Blastodacna atra Hw.,1992,6/26/92,1992-06-28,1
42,LEPIDOPTERA,AGONOXENIDAE,Blastodacna atra Hw.,1992,7/24/92,1992-07-28,1
43,LEPIDOPTERA,AGONOXENIDAE,Blastodacna atra Hw.,1993,7/1/93,1993-07-04,3
44,LEPIDOPTERA,AGONOXENIDAE,Blastodacna atra Hw.,1994,7/4/94,1994-07-06,1
45,LEPIDOPTERA,AGONOXENIDAE,Blastodacna atra Hw.,1994,7/7/94,1994-07-11,1
46,LEPIDOPTERA,AGONOXENIDAE,Blastodacna atra Hw.,1994,7/15/94,1994-07-17,1
47,LEPIDOPTERA,AGONOXENIDAE,Blastodacna atra Hw.,1994,7/20/94,1994-07-21,2
48,LEPIDOPTERA,AGONOXENIDAE,Blastodacna atra Hw.,1994,7/22/94,1994-07-24,1
49,LEPIDOPTERA,AGONOXENIDAE,Blastodacna atra Hw.,1994,8/5/94,1994-08-07,1
50,LEPIDOPTERA,AGONOXENIDAE,Blastodacna atra Hw.,1995,7/4/95,1995-07-06,3
51,LEPIDOPTERA,AGONOXENIDAE,Blastodacna atra Hw.,1995,7/7/95,1995-07-09,1
52,LEPIDOPTERA,AGONOXENIDAE,Blastodacna atra Hw.,1995,7/10/95,1995-07-13,1
53,LEPIDOPTERA,AGONOXENIDAE,Blastodacna atra Hw.,1995,7/21/95,1995-07-21,1
54,LEPIDOPTERA,AGONOXENIDAE,Blastodacna atra Hw.,1995,7/30/95,1995-07-30,2
55,LEPIDOPTERA,AGONOXENIDAE,Blastodacna atra Hw.,1995,8/2/95,1995-08-02,1
56,LEPIDOPTERA,AGONOXENIDAE,Blastodacna atra Hw.,1995,8/3/95,1995-08-03,1
57,LEPIDOPTERA,AGONOXENIDAE,Blastodacna atra Hw.,1995,8/14/95,1995-08-16,2
58,LEPIDOPTERA,AGONOXENIDAE,Blastodacna atra Hw.,1996,6/21/96,1996-06-25,1
59,LEPIDOPTERA,AGONOXENIDAE,Blastodacna atra Hw.,1996,6/26/96,1996-06-30,1
60,LEPIDOPTERA,AGONOXENIDAE,Blastodacna atra Hw.,1996,7/12/96,1996-07-17,2
61,LEPIDOPTERA,AGONOXENIDAE,Blastodacna atra Hw.,1996,7/26/96,1996-07-29,1
62,LEPIDOPTERA,AGONOXENIDAE,Blastodacna atra Hw.,1996,7/30/96,1996-08-01,1
63,LEPIDOPTERA,AGONOXENIDAE,Blastodacna atra Hw.,1997,6/24/97,1997-06-30,1
64,LEPIDOPTERA,AGONOXENIDAE,Blastodacna atra Hw.,1997,7/1/97,1997-07-03,1
65,LEPIDOPTERA,AGONOXENIDAE,Blastodacna atra Hw.,1997,7/7/97,1997-07-08,3
66,LEPIDOPTERA,AGONOXENIDAE,Blastodacna atra Hw.,1997,7/9/97,1997-07-10,1
67,LEPIDOPTERA,AGONOXENIDAE,Blastodacna atra Hw.,1997,8/1/97,1997-08-03,1
68,LEPIDOPTERA,AGONOXENIDAE,Blastodacna atra Hw.,1998,6/22/98,1998-06-25,1
69,LEPIDOPTERA,AGONOXENIDAE,Blastodacna atra Hw.,1998,7/13/98,1998-07-19,1
70,LEPIDOPTERA,AGONOXENIDAE,Blastodacna atra Hw.,1998,7/22/98,1998-07-23,2
71,LEPIDOPTERA,AGONOXENIDAE,Blastodacna atra Hw.,1998,7/29/98,1998-08-02,1
72,LEPIDOPTERA,AGONOXENIDAE,Blastodacna atra Hw.,1998,8/14/98,1998-08-18,1
73,LEPIDOPTERA,AGONOXENIDAE,Blastodacna atra Hw.,1998,8/21/98,1998-08-23,1
74,LEPIDOPTERA,AGONOXENIDAE,Blastodacna atra Hw.,1999,6/17/99,1999-06-20,2
75,LEPIDOPTERA,AGONOXENIDAE,Blastodacna atra Hw.,1999,6/30/99,1999-07-01,1
76,LEPIDOPTERA,AGONOXENIDAE,Blastodacna atra Hw.,1999,7/5/99,1999-07-06,1
77,LEPIDOPTERA,AGONOXENIDAE,Blastodacna atra Hw.,1999,8/13/99,1999-08-15,1
78,LEPIDOPTERA,AGONOXENIDAE,Blastodacna atra Hw.,2000,6/16/00,2000-06-21,5
79,LEPIDOPTERA,AGONOXENIDAE,Blastodacna atra Hw.,2000,6/22/00,2000-06-27,1
80,LEPIDOPTERA,AGONOXENIDAE,Blastodacna atra Hw.,2000,7/12/00,2000-07-18,1
81,LEPIDOPTERA,AGONOXENIDAE,Blastodacna atra Hw.,2000,8/4/00,2000-08-13,2
82,LEPIDOPTERA,AGONOXENIDAE,Blastodacna atra Hw.,2001,6/25/01,2001-06-27,1
83,LEPIDOPTERA,AGONOXENIDAE,Blastodacna atra Hw.,2001,7/2/01,2001-07-03,1
84,LEPIDOPTERA,AGONOXENIDAE,Blastodacna atra Hw.,2001,7/20/01,2001-07-23,1
85,LEPIDOPTERA,AGONOXENIDAE,Blastodacna atra Hw.,2001,8/10/01,2001-08-13,1
86,LEPIDOPTERA,AGONOXENIDAE,Blastodacna atra Hw.,2001,8/14/01,2001-08-16,1
87,LEPIDOPTERA,AGONOXENIDAE,Blastodacna atra Hw.,2002,6/17/02,2002-06-18,2
88,LEPIDOPTERA,AGONOXENIDAE,Blastodacna atra Hw.,2002,6/19/02,2002-06-27,2
89,LEPIDOPTERA,AGONOXENIDAE,Blastodacna atra Hw.,2002,7/12/02,2002-07-15,2
90,LEPIDOPTERA,AGONOXENIDAE,Blastodacna atra Hw.,2002,7/16/02,2002-07-17,1
91,LEPIDOPTERA,AGONOXENIDAE,Blastodacna atra Hw.,2003,6/23/03,2003-07-10,4
92,LEPIDOPTERA,AGONOXENIDAE,Blastodacna atra Hw.,2004,7/30/04,2004-08-01,2
93,LEPIDOPTERA,AGONOXENIDAE,Blastodacna atra Hw.,2004,8/2/04,2004-08-03,1
94,LEPIDOPTERA,AGONOXENIDAE,Blastodacna atra Hw.,2005,6/18/05,2005-06-21,4
95,LEPIDOPTERA,AGONOXENIDAE,Blastodacna atra Hw.,2005,6/22/05,2005-06-26,1
96,LEPIDOPTERA,AGONOXENIDAE,Blastodacna atra Hw.,2005,6/27/05,2005-06-30,2
97,LEPIDOPTERA,AGONOXENIDAE,Blastodacna atra Hw.,2005,7/7/05,2005-07-07,2
98,LEPIDOPTERA,AGONOXENIDAE,Blastodacna atra Hw.,2005,7/8/05,2005-07-10,1
99,LEPIDOPTERA,AGONOXENIDAE,Blastodacna atra Hw.,2005,7/11/05,2005-07-11,1
100,LEPIDOPTERA,AGONOXENIDAE,Blastodacna atra Hw.,2005,7/22/05,2005-07-26,1
101,LEPIDOPTERA,AGONOXENIDAE,Blastodacna atra Hw.,2006,7/3/06,2006-07-06,1
102,LEPIDOPTERA,AGONOXENIDAE,Blastodacna atra Hw.,2006,7/7/06,2006-07-09,1
103,LEPIDOPTERA,AGONOXENIDAE,Blastodacna atra Hw.,2006,7/14/06,2006-07-20,1
104,LEPIDOPTERA,AGONOXENIDAE,Blastodacna atra Hw.,2006,9/7/06,2006-09-13,1
105,LEPIDOPTERA,AGONOXENIDAE,Blastodacna atra Hw.,2008,6/17/08,2008-06-22,1
106,LEPIDOPTERA,AGONOXENIDAE,Blastodacna atra Hw.,2008,7/3/08,2008-07-08,1
107,LEPIDOPTERA,AGONOXENIDAE,Blastodacna atra Hw.,2008,7/11/08,2008-07-23,2
108,LEPIDOPTERA,AGONOXENIDAE,Blastodacna atra Hw.,2008,7/29/08,2008-08-03,1
109,LEPIDOPTERA,AGONOXENIDAE,Blastodacna atra Hw.,2009,7/3/09,2009-07-10,3
110,LEPIDOPTERA,AGONOXENIDAE,Blastodacna atra Hw.,2009,7/11/09,2009-07-20,1
111,LEPIDOPTERA,AGONOXENIDAE,Blastodacna atra Hw.,2009,7/28/09,2009-08-02,1
112,LEPIDOPTERA,AGONOXENIDAE,Blastodacna hellerella Dup.,1992,6/22/92,1992-06-23,1
113,LEPIDOPTERA,AGONOXENIDAE,Blastodacna hellerella Dup.,1992,6/26/92,1992-06-28,1
114,LEPIDOPTERA,AGONOXENIDAE,Blastodacna hellerella Dup.,1993,6/1/93,1993-06-06,1
115,LEPIDOPTERA,AGONOXENIDAE,Blastodacna hellerella Dup.,1993,6/25/93,1993-06-27,1
116,LEPIDOPTERA,AGONOXENIDAE,Blastodacna hellerella Dup.,1993,6/28/93,1993-06-30,1
117,LEPIDOPTERA,AGONOXENIDAE,Blastodacna hellerella Dup.,1993,7/1/93,1993-07-04,1
118,LEPIDOPTERA,AGONOXENIDAE,Blastodacna hellerella Dup.,1993,7/8/93,1993-07-11,1
119,LEPIDOPTERA,AGONOXENIDAE,Blastodacna hellerella Dup.,1994,6/24/94,1994-06-28,4
120,LEPIDOPTERA,AGONOXENIDAE,Blastodacna hellerella Dup.,1994,7/4/94,1994-07-06,1
121,LEPIDOPTERA,AGONOXENIDAE,Blastodacna hellerella Dup.,1995,7/14/95,1995-07-17,1
122,LEPIDOPTERA,AGONOXENIDAE,Blastodacna hellerella Dup.,1996,6/26/96,1996-06-30,1
123,LEPIDOPTERA,AGONOXENIDAE,Blastodacna hellerella Dup.,1996,7/5/96,1996-07-11,2
124,LEPIDOPTERA,AGONOXENIDAE,Blastodacna hellerella Dup.,1997,6/9/97,1997-06-12,1
125,LEPIDOPTERA,AGONOXENIDAE,Blastodacna hellerella Dup.,1997,6/24/97,1997-06-30,1
126,LEPIDOPTERA,AGONOXENIDAE,Blastodacna hellerella Dup.,1997,7/7/97,1997-07-08,2
127,LEPIDOPTERA,AGONOXENIDAE,Blastodacna hellerella Dup.,1997,7/11/97,1997-07-13,1
128,LEPIDOPTERA,AGONOXENIDAE,Blastodacna hellerella Dup.,1998,6/19/98,1998-06-21,1
129,LEPIDOPTERA,AGONOXENIDAE,Blastodacna hellerella Dup.,1998,7/3/98,1998-07-08,1
130,LEPIDOPTERA,AGONOXENIDAE,Blastodacna hellerella Dup.,1999,6/14/99,1999-06-16,1
131,LEPIDOPTERA,AGONOXENIDAE,Blastodacna hellerella Dup.,1999,6/17/99,1999-06-20,1
132,LEPIDOPTERA,AGONOXENIDAE,Blastodacna hellerella Dup.,1999,6/21/99,1999-06-27,5
133,LEPIDOPTERA,AGONOXENIDAE,Blastodacna hellerella Dup.,1999,6/28/99,1999-06-29,1
134,LEPIDOPTERA,AGONOXENIDAE,Blastodacna hellerella Dup.,1999,6/30/99,1999-07-01,1
135,LEPIDOPTERA,AGONOXENIDAE,Blastodacna hellerella Dup.,1999,7/2/99,1999-07-04,5
136,LEPIDOPTERA,AGONOXENIDAE,Blastodacna hellerella Dup.,1999,7/5/99,1999-07-06,1
137,LEPIDOPTERA,AGONOXENIDAE,Blastodacna hellerella Dup.,1999,7/9/99,1999-07-11,3
138,LEPIDOPTERA,AGONOXENIDAE,Blastodacna hellerella Dup.,1999,7/12/99,1999-07-19,1
139,LEPIDOPTERA,AGONOXENIDAE,Blastodacna hellerella Dup.,2000,6/9/00,2000-06-12,1
140,LEPIDOPTERA,AGONOXENIDAE,Blastodacna hellerella Dup.,2000,6/16/00,2000-06-21,2
141,LEPIDOPTERA,AGONOXENIDAE,Blastodacna hellerella Dup.,2001,6/20/01,2001-06-24,2
142,LEPIDOPTERA,AGONOXENIDAE,Blastodacna hellerella Dup.,2001,6/25/01,2001-06-27,4
143,LEPIDOPTERA,AGONOXENIDAE,Blastodacna hellerella Dup.,2001,6/28/01,2001-07-01,5
144,LEPIDOPTERA,AGONOXENIDAE,Blastodacna hellerella Dup.,2001,7/2/01,2001-07-03,2
145,LEPIDOPTERA,AGONOXENIDAE,Blastodacna hellerella Dup.,2001,7/4/01,2001-07-08,2
146,LEPIDOPTERA,AGONOXENIDAE,Blastodacna hellerella Dup.,2002,6/1/02,2002-06-10,1
147,LEPIDOPTERA,AGONOXENIDAE,Blastodacna hellerella Dup.,2002,6/11/02,2002-06-16,1
148,LEPIDOPTERA,AGONOXENIDAE,Blastodacna hellerella Dup.,2002,6/17/02,2002-06-18,1
149,LEPIDOPTERA,AGONOXENIDAE,Blastodacna hellerella Dup.,2002,6/19/02,2002-06-27,1
150,LEPIDOPTERA,AGONOXENIDAE,Blastodacna hellerella Dup.,2003,6/10/03,2003-06-15,2
151,LEPIDOPTERA,AGONOXENIDAE,Blastodacna hellerella Dup.,2004,6/28/04,2004-06-30,1
152,LEPIDOPTERA,AGONOXENIDAE,Blastodacna hellerella Dup.,2005,6/18/05,2005-06-21,1
153,LEPIDOPTERA,AGONOXENIDAE,Blastodacna hellerella Dup.,2006,6/29/06,2006-07-02,1
154,LEPIDOPTERA,AGONOXENIDAE,Blastodacna hellerella Dup.,2007,6/7/07,2007-06-10,1
155,LEPIDOPTERA,AGONOXENIDAE,Blastodacna hellerella Dup.,2007,6/11/07,2007-06-12,1
156,LEPIDOPTERA,AGONOXENIDAE,Blastodacna hellerella Dup.,2007,6/18/07,2007-06-21,1
157,LEPIDOPTERA,AGONOXENIDAE,Blastodacna hellerella Dup.,2008,6/3/08,2008-06-08,1
158,LEPIDOPTERA,AGONOXENIDAE,Blastodacna hellerella Dup.,2008,6/9/08,2008-06-16,1
159,LEPIDOPTERA,AGONOXENIDAE,Blastodacna hellerella Dup.,2008,6/23/08,2008-06-25,1
160,LEPIDOPTERA,AGONOXENIDAE,Blastodacna hellerella Dup.,2008,6/26/08,2008-07-02,1
161,LEPIDOPTERA,AGONOXENIDAE,Blastodacna hellerella Dup.,2008,7/3/08,2008-07-08,1
162,LEPIDOPTERA,AGONOXENIDAE,Blastodacna hellerella Dup.,2009,6/26/09,2009-06-28,1
163,LEPIDOPTERA,AGONOXENIDAE,Blastodacna hellerella Dup.,2009,6/29/09,2009-06-29,1
164,LEPIDOPTERA,AGONOXENIDAE,Chrysoclista linneella Cl.,1994,7/20/94,1994-07-21,1
165,LEPIDOPTERA,AGONOXENIDAE,Chrysoclista linneella Cl.,1997,8/8/97,1997-08-13,1
166,LEPIDOPTERA,AGONOXENIDAE,Chrysoclista linneella Cl.,2001,7/26/01,2001-07-29,1
167,LEPIDOPTERA,AGONOXENIDAE,Chrysoclista linneella Cl.,2008,8/4/08,2008-08-07,1
168,LEPIDOPTERA,ALUCITIDAE,Alucita hexadactyla L.,1994,6/8/94,1994-06-13,1
169,LEPIDOPTERA,ALUCITIDAE,Alucita hexadactyla L.,1995,4/26/95,1995-05-08,1
170,LEPIDOPTERA,ALUCITIDAE,Alucita hexadactyla L.,1997,5/7/97,1997-05-29,1
171,LEPIDOPTERA,ALUCITIDAE,Alucita hexadactyla L.,1997,6/13/97,1997-06-22,1
172,LEPIDOPTERA,ALUCITIDAE,Alucita hexadactyla L.,1998,8/14/98,1998-08-18,1
173,LEPIDOPTERA,ALUCITIDAE,Alucita hexadactyla L.,2003,5/21/03,2003-05-26,1
174,LEPIDOPTERA,ALUCITIDAE,Alucita hexadactyla L.,2004,5/18/04,2004-06-07,1
175,LEPIDOPTERA,ALUCITIDAE,Alucita hexadactyla L.,2005,7/22/05,2005-07-26,1
176,LEPIDOPTERA,ALUCITIDAE,Alucita hexadactyla L.,2006,5/19/06,2006-05-31,1
177,LEPIDOPTERA,ALUCITIDAE,Alucita hexadactyla L.,2006,6/1/06,2006-06-08,4
178,LEPIDOPTERA,ALUCITIDAE,Alucita hexadactyla L.,2009,5/20/09,2009-06-02,1
179,LEPIDOPTERA,AMPHISBATHIDAE,Pseudatemelia josephinae Toll,2009,7/11/09,2009-07-20,1
180,LEPIDOPTERA,ARCTIIDAE,Arctia caja L.,1992,7/10/92,1992-07-12,1
181,LEPIDOPTERA,ARCTIIDAE,Arctia caja L.,1997,7/21/97,1997-07-21,1
182,LEPIDOPTERA,ARCTIIDAE,Arctia caja L.,2003,7/11/03,2003-07-14,1
183,LEPIDOPTERA,ARCTIIDAE,Arctia caja L.,2005,8/3/05,2005-08-05,1
184,LEPIDOPTERA,ARCTIIDAE,Atolmis rubricollis L.,1992,6/29/92,1992-07-02,1
185,LEPIDOPTERA,ARCTIIDAE,Atolmis rubricollis L.,1992,7/6/92,1992-07-08,1
186,LEPIDOPTERA,ARCTIIDAE,Atolmis rubricollis L.,1995,7/7/95,1995-07-09,1
187,LEPIDOPTERA,ARCTIIDAE,Atolmis rubricollis L.,2000,6/16/00,2000-06-21,1
188,LEPIDOPTERA,ARCTIIDAE,Atolmis rubricollis L.,2003,6/23/03,2003-07-10,1
189,LEPIDOPTERA,ARCTIIDAE,Atolmis rubricollis L.,2004,6/24/04,2004-06-27,1
190,LEPIDOPTERA,ARCTIIDAE,Atolmis rubricollis L.,2005,6/22/05,2005-06-26,1
191,LEPIDOPTERA,ARCTIIDAE,Atolmis rubricollis L.,2006,6/14/06,2006-06-20,1
192,LEPIDOPTERA,ARCTIIDAE,Atolmis rubricollis L.,2006,6/21/06,2006-06-25,1
193,LEPIDOPTERA,ARCTIIDAE,Atolmis rubricollis L.,2006,6/26/06,2006-06-28,3
194,LEPIDOPTERA,ARCTIIDAE,Atolmis rubricollis L.,2006,7/3/06,2006-07-06,1
195,LEPIDOPTERA,ARCTIIDAE,Atolmis rubricollis L.,2007,6/7/07,2007-06-10,1
196,LEPIDOPTERA,ARCTIIDAE,Atolmis rubricollis L.,2007,6/22/07,2007-06-25,1
197,LEPIDOPTERA,ARCTIIDAE,Atolmis rubricollis L.,2007,6/29/07,2007-07-08,1
198,LEPIDOPTERA,ARCTIIDAE,Atolmis rubricollis L.,2009,6/26/09,2009-06-28,2
199,LEPIDOPTERA,ARCTIIDAE,Atolmis rubricollis L.,2009,6/30/09,2009-07-02,4
200,LEPIDOPTERA,ARCTIIDAE,Callimorpha dominula L.,2009,7/3/09,2009-07-10,1
201,LEPIDOPTERA,ARCTIIDAE,Cybosia mesomella L.,2000,6/28/00,2000-07-02,1
202,LEPIDOPTERA,ARCTIIDAE,Cybosia mesomella L.,2004,7/30/04,2004-08-01,1
203,LEPIDOPTERA,ARCTIIDAE,Eilema complana L.,1994,7/12/94,1994-07-14,1
204,LEPIDOPTERA,ARCTIIDAE,Eilema complana L.,1996,8/14/96,1996-08-15,1
205,LEPIDOPTERA,ARCTIIDAE,Eilema complana L.,1996,8/16/96,1996-08-18,1
206,LEPIDOPTERA,ARCTIIDAE,Eilema complana L.,2002,7/18/02,2002-07-28,1
207,LEPIDOPTERA,ARCTIIDAE,Eilema complana L.,2002,8/1/02,2002-08-04,1
208,LEPIDOPTERA,ARCTIIDAE,Eilema complana L.,2003,7/21/03,2003-07-24,1
209,LEPIDOPTERA,ARCTIIDAE,Eilema complana L.,2003,7/25/03,2003-07-31,1
210,LEPIDOPTERA,ARCTIIDAE,Eilema complana L.,2004,8/9/04,2004-08-10,1
211,LEPIDOPTERA,ARCTIIDAE,Eilema complana L.,2005,7/8/05,2005-07-10,1
212,LEPIDOPTERA,ARCTIIDAE,Eilema depressa Esp.,1995,7/14/95,1995-07-17,1
213,LEPIDOPTERA,ARCTIIDAE,Eilema depressa Esp.,1996,8/2/96,1996-08-08,1
214,LEPIDOPTERA,ARCTIIDAE,Eilema depressa Esp.,1998,7/20/98,1998-07-21,1
215,LEPIDOPTERA,ARCTIIDAE,Eilema depressa Esp.,2003,7/21/03,2003-07-24,1
216,LEPIDOPTERA,ARCTIIDAE,Eilema depressa Esp.,2003,8/1/03,2003-08-08,1
217,LEPIDOPTERA,ARCTIIDAE,Eilema depressa Esp.,2004,7/15/04,2004-07-18,1
218,LEPIDOPTERA,ARCTIIDAE,Eilema depressa Esp.,2005,7/12/05,2005-07-14,1
219,LEPIDOPTERA,ARCTIIDAE,Eilema depressa Esp.,2005,9/19/05,2005-09-21,1
220,LEPIDOPTERA,ARCTIIDAE,Eilema depressa Esp.,2006,7/14/06,2006-07-20,2
221,LEPIDOPTERA,ARCTIIDAE,Eilema depressa Esp.,2006,7/21/06,2006-07-27,4
222,LEPIDOPTERA,ARCTIIDAE,Eilema depressa Esp.,2007,6/29/07,2007-07-08,1
223,LEPIDOPTERA,ARCTIIDAE,Eilema depressa Esp.,2007,7/9/07,2007-07-18,1
224,LEPIDOPTERA,ARCTIIDAE,Eilema depressa Esp.,2007,7/19/07,2007-07-25,1
225,LEPIDOPTERA,ARCTIIDAE,Eilema depressa Esp.,2007,8/3/07,2007-08-08,1
226,LEPIDOPTERA,ARCTIIDAE,Eilema depressa Esp.,2009,7/11/09,2009-07-20,1
227,LEPIDOPTERA,ARCTIIDAE,Eilema lurideola Zinck.,1996,7/5/96,1996-07-11,1
228,LEPIDOPTERA,ARCTIIDAE,Eilema lurideola Zinck.,1997,7/24/97,1997-07-24,1
229,LEPIDOPTERA,ARCTIIDAE,Eilema lurideola Zinck.,2002,7/18/02,2002-07-28,1
230,LEPIDOPTERA,ARCTIIDAE,Eilema lurideola Zinck.,2003,7/21/03,2003-07-24,1
231,LEPIDOPTERA,ARCTIIDAE,Eilema lurideola Zinck.,2004,7/30/04,2004-08-01,1
232,LEPIDOPTERA,ARCTIIDAE,Eilema lutarella L.,1994,7/12/94,1994-07-14,1
233,LEPIDOPTERA,ARCTIIDAE,Eilema lutarella L.,1996,7/26/96,1996-07-29,1
234,LEPIDOPTERA,ARCTIIDAE,Eilema lutarella L.,1997,7/16/97,1997-07-20,2
235,LEPIDOPTERA,ARCTIIDAE,Eilema lutarella L.,1997,7/21/97,1997-07-21,1
236,LEPIDOPTERA,ARCTIIDAE,Eilema lutarella L.,1998,7/22/98,1998-07-23,1
237,LEPIDOPTERA,ARCTIIDAE,Eilema lutarella L.,1998,7/27/98,1998-07-28,1
238,LEPIDOPTERA,ARCTIIDAE,Eilema lutarella L.,2000,7/21/00,2000-07-24,1
239,LEPIDOPTERA,ARCTIIDAE,Eilema lutarella L.,2002,7/18/02,2002-07-28,6
240,LEPIDOPTERA,ARCTIIDAE,Eilema lutarella L.,2003,7/15/03,2003-07-20,1
241,LEPIDOPTERA,ARCTIIDAE,Eilema lutarella L.,2003,7/21/03,2003-07-24,3
242,LEPIDOPTERA,ARCTIIDAE,Eilema lutarella L.,2004,7/19/04,2004-07-21,1
243,LEPIDOPTERA,ARCTIIDAE,Eilema lutarella L.,2004,7/30/04,2004-08-01,2
244,LEPIDOPTERA,ARCTIIDAE,Eilema lutarella L.,2004,8/2/04,2004-08-03,9
245,LEPIDOPTERA,ARCTIIDAE,Eilema lutarella L.,2006,7/14/06,2006-07-20,1
246,LEPIDOPTERA,ARCTIIDAE,Eilema sororcula Hfn.,2000,5/17/00,2000-06-08,1
247,LEPIDOPTERA,ARCTIIDAE,Eilema sororcula Hfn.,2001,5/22/01,2001-05-31,1
248,LEPIDOPTERA,ARCTIIDAE,Eilema sororcula Hfn.,2004,5/18/04,2004-06-07,1
249,LEPIDOPTERA,ARCTIIDAE,Eilema sororcula Hfn.,2005,5/30/05,2005-06-02,1
250,LEPIDOPTERA,ARCTIIDAE,Eilema sororcula Hfn.,2006,6/1/06,2006-06-08,2
251,LEPIDOPTERA,ARCTIIDAE,Eilema sororcula Hfn.,2006,6/9/06,2006-06-11,1
252,LEPIDOPTERA,ARCTIIDAE,Eilema sororcula Hfn.,2007,5/22/07,2007-05-30,2
253,LEPIDOPTERA,ARCTIIDAE,Lithosia quadra L.,2008,7/24/08,2008-07-28,1
254,LEPIDOPTERA,ARCTIIDAE,Miltochrista miniata Forst.,1999,7/12/99,1999-07-19,1
255,LEPIDOPTERA,ARCTIIDAE,Miltochrista miniata Forst.,2004,7/22/04,2004-07-25,1
256,LEPIDOPTERA,ARCTIIDAE,Miltochrista miniata Forst.,2005,7/8/05,2005-07-10,1
257,LEPIDOPTERA,ARCTIIDAE,Pelosia muscerda Hfn.,1997,8/1/97,1997-08-03,1
258,LEPIDOPTERA,ARCTIIDAE,Pelosia muscerda Hfn.,2002,7/8/02,2002-07-11,1
259,LEPIDOPTERA,ARCTIIDAE,Pelosia muscerda Hfn.,2003,7/21/03,2003-07-24,1
260,LEPIDOPTERA,ARCTIIDAE,Pelosia muscerda Hfn.,2003,7/25/03,2003-07-31,3
261,LEPIDOPTERA,ARCTIIDAE,Pelosia muscerda Hfn.,2005,7/30/05,2005-08-02,1
262,LEPIDOPTERA,ARCTIIDAE,Pelosia muscerda Hfn.,2005,8/3/05,2005-08-05,1
263,LEPIDOPTERA,ARCTIIDAE,Pelosia muscerda Hfn.,2006,7/21/06,2006-07-27,1
264,LEPIDOPTERA,ARCTIIDAE,Pelosia muscerda Hfn.,2007,8/9/07,2007-08-13,1
265,LEPIDOPTERA,ARCTIIDAE,Pelosia muscerda Hfn.,2009,7/11/09,2009-07-20,1
266,LEPIDOPTERA,ARCTIIDAE,Pelosia muscerda Hfn.,2009,7/28/09,2009-08-02,3
267,LEPIDOPTERA,ARCTIIDAE,Phragmatobia fuliginosa L.,1994,7/20/94,1994-07-21,1
268,LEPIDOPTERA,ARCTIIDAE,Phragmatobia fuliginosa L.,1994,7/27/94,1994-07-27,1
269,LEPIDOPTERA,ARCTIIDAE,Phragmatobia fuliginosa L.,1994,8/10/94,1994-08-11,1
270,LEPIDOPTERA,ARCTIIDAE,Phragmatobia fuliginosa L.,1996,8/2/96,1996-08-08,2
271,LEPIDOPTERA,ARCTIIDAE,Phragmatobia fuliginosa L.,1997,8/1/97,1997-08-03,1
272,LEPIDOPTERA,ARCTIIDAE,Phragmatobia fuliginosa L.,1998,7/22/98,1998-07-23,1
273,LEPIDOPTERA,ARCTIIDAE,Phragmatobia fuliginosa L.,1999,7/12/99,1999-07-19,1
274,LEPIDOPTERA,ARCTIIDAE,Phragmatobia fuliginosa L.,1999,7/20/99,1999-07-21,1
275,LEPIDOPTERA,ARCTIIDAE,Phragmatobia fuliginosa L.,2000,7/21/00,2000-07-24,1
276,LEPIDOPTERA,ARCTIIDAE,Phragmatobia fuliginosa L.,2001,8/3/01,2001-08-06,1
277,LEPIDOPTERA,ARCTIIDAE,Phragmatobia fuliginosa L.,2002,7/8/02,2002-07-11,1
278,LEPIDOPTERA,ARCTIIDAE,Phragmatobia fuliginosa L.,2002,7/12/02,2002-07-15,1
279,LEPIDOPTERA,ARCTIIDAE,Phragmatobia fuliginosa L.,2002,7/18/02,2002-07-28,7
280,LEPIDOPTERA,ARCTIIDAE,Phragmatobia fuliginosa L.,2002,8/1/02,2002-08-04,2
281,LEPIDOPTERA,ARCTIIDAE,Phragmatobia fuliginosa L.,2003,7/15/03,2003-07-20,1
282,LEPIDOPTERA,ARCTIIDAE,Phragmatobia fuliginosa L.,2003,7/25/03,2003-07-31,1
283,LEPIDOPTERA,ARCTIIDAE,Phragmatobia fuliginosa L.,2003,8/1/03,2003-08-08,1
284,LEPIDOPTERA,ARCTIIDAE,Phragmatobia fuliginosa L.,2004,8/2/04,2004-08-03,1
285,LEPIDOPTERA,ARCTIIDAE,Phragmatobia fuliginosa L.,2004,8/6/04,2004-08-08,2
286,LEPIDOPTERA,ARCTIIDAE,Phragmatobia fuliginosa L.,2005,7/8/05,2005-07-10,1
287,LEPIDOPTERA,ARCTIIDAE,Phragmatobia fuliginosa L.,2005,7/18/05,2005-07-19,1
288,LEPIDOPTERA,ARCTIIDAE,Phragmatobia fuliginosa L.,2005,7/27/05,2005-07-29,1
289,LEPIDOPTERA,ARCTIIDAE,Phragmatobia fuliginosa L.,2006,7/14/06,2006-07-20,1
290,LEPIDOPTERA,ARCTIIDAE,Phragmatobia fuliginosa L.,2006,7/21/06,2006-07-27,1
291,LEPIDOPTERA,ARCTIIDAE,Phragmatobia fuliginosa L.,2007,7/19/07,2007-07-25,1
292,LEPIDOPTERA,ARCTIIDAE,Phragmatobia fuliginosa L.,2008,7/3/08,2008-07-08,1
293,LEPIDOPTERA,ARCTIIDAE,Phragmatobia fuliginosa L.,2008,7/11/08,2008-07-23,5
294,LEPIDOPTERA,ARCTIIDAE,Phragmatobia fuliginosa L.,2008,7/29/08,2008-08-03,1
295,LEPIDOPTERA,ARCTIIDAE,Phragmatobia fuliginosa L.,2008,8/4/08,2008-08-07,1
296,LEPIDOPTERA,ARCTIIDAE,Phragmatobia fuliginosa L.,2009,7/21/09,2009-07-27,1
297,LEPIDOPTERA,ARCTIIDAE,Phragmatobia fuliginosa L.,2009,7/28/09,2009-08-02,1
298,LEPIDOPTERA,ARCTIIDAE,Phragmatobia fuliginosa L.,2009,8/10/09,2009-08-16,1
299,LEPIDOPTERA,ARCTIIDAE,Spilosoma lubricipeda L.,1998,6/2/98,1998-06-07,1
300,LEPIDOPTERA,ARCTIIDAE,Spilosoma lubricipeda L.,2006,6/1/06,2006-06-08,1
301,LEPIDOPTERA,ARCTIIDAE,Spilosoma lutea Hfn.,1993,6/22/93,1993-06-24,1
302,LEPIDOPTERA,ARCTIIDAE,Spilosoma lutea Hfn.,1997,6/24/97,1997-06-30,1
303,LEPIDOPTERA,ARCTIIDAE,Spilosoma lutea Hfn.,2003,6/23/03,2003-07-10,1
304,LEPIDOPTERA,ARCTIIDAE,Spilosoma lutea Hfn.,2003,8/19/03,2003-08-28,1
305,LEPIDOPTERA,ARCTIIDAE,Spilosoma lutea Hfn.,2005,6/9/05,2005-06-14,1
306,LEPIDOPTERA,ARCTIIDAE,Spilosoma urticae Esp.,2002,6/1/02,2002-06-10,1
307,LEPIDOPTERA,ARCTIIDAE,Spilosoma urticae Esp.,2003,6/2/03,2003-06-09,1
308,LEPIDOPTERA,ARCTIIDAE,Thumatha senex Hb.,1992,7/3/92,1992-07-05,1
309,LEPIDOPTERA,ARCTIIDAE,Thumatha senex Hb.,1997,7/4/97,1997-07-06,1
310,LEPIDOPTERA,ARCTIIDAE,Thumatha senex Hb.,1997,7/7/97,1997-07-08,1
311,LEPIDOPTERA,AUTOSTICHIDAE,Oegoconia caradjai PG. & Cap.,2003,8/1/03,2003-08-08,5
312,LEPIDOPTERA,AUTOSTICHIDAE,Oegoconia caradjai PG. & Cap.,2003,8/9/03,2003-08-14,3
313,LEPIDOPTERA,AUTOSTICHIDAE,Oegoconia caradjai PG. & Cap.,2003,8/19/03,2003-08-28,1
314,LEPIDOPTERA,AUTOSTICHIDAE,Oegoconia caradjai PG. & Cap.,2004,7/15/04,2004-07-18,1
315,LEPIDOPTERA,AUTOSTICHIDAE,Oegoconia caradjai PG. & Cap.,2004,8/16/04,2004-08-17,1
316,LEPIDOPTERA,AUTOSTICHIDAE,Oegoconia caradjai PG. & Cap.,2005,6/27/05,2005-06-30,1
317,LEPIDOPTERA,AUTOSTICHIDAE,Oegoconia caradjai PG. & Cap.,2005,7/12/05,2005-07-14,1
318,LEPIDOPTERA,AUTOSTICHIDAE,Oegoconia caradjai PG. & Cap.,2005,7/20/05,2005-07-21,1
319,LEPIDOPTERA,AUTOSTICHIDAE,Oegoconia caradjai PG. & Cap.,2005,7/22/05,2005-07-26,2
320,LEPIDOPTERA,AUTOSTICHIDAE,Oegoconia caradjai PG. & Cap.,2005,7/27/05,2005-07-29,1
321,LEPIDOPTERA,AUTOSTICHIDAE,Oegoconia caradjai PG. & Cap.,2005,7/30/05,2005-08-02,1
322,LEPIDOPTERA,AUTOSTICHIDAE,Oegoconia caradjai PG. & Cap.,2005,8/6/05,2005-08-14,1
323,LEPIDOPTERA,AUTOSTICHIDAE,Oegoconia caradjai PG. & Cap.,2005,8/15/05,2005-08-16,1
324,LEPIDOPTERA,AUTOSTICHIDAE,Oegoconia caradjai PG. & Cap.,2006,6/1/06,2006-06-08,1
325,LEPIDOPTERA,AUTOSTICHIDAE,Oegoconia caradjai PG. & Cap.,2006,7/10/06,2006-07-13,1
326,LEPIDOPTERA,AUTOSTICHIDAE,Oegoconia caradjai PG. & Cap.,2006,7/14/06,2006-07-20,1
327,LEPIDOPTERA,AUTOSTICHIDAE,Oegoconia caradjai PG. & Cap.,2006,7/21/06,2006-07-27,4
328,LEPIDOPTERA,AUTOSTICHIDAE,Oegoconia caradjai PG. & Cap.,2006,7/28/06,2006-08-03,4
329,LEPIDOPTERA,AUTOSTICHIDAE,Oegoconia caradjai PG. & Cap.,2006,8/4/06,2006-08-06,4
330,LEPIDOPTERA,AUTOSTICHIDAE,Oegoconia caradjai PG. & Cap.,2006,8/7/06,2006-08-10,9
331,LEPIDOPTERA,AUTOSTICHIDAE,Oegoconia caradjai PG. & Cap.,2006,8/11/06,2006-08-16,2
332,LEPIDOPTERA,AUTOSTICHIDAE,Oegoconia caradjai PG. & Cap.,2006,8/17/06,2006-08-24,1
333,LEPIDOPTERA,AUTOSTICHIDAE,Oegoconia caradjai PG. & Cap.,2006,8/25/06,2006-08-31,1
334,LEPIDOPTERA,AUTOSTICHIDAE,Oegoconia caradjai PG. & Cap.,2007,6/18/07,2007-06-21,1
335,LEPIDOPTERA,AUTOSTICHIDAE,Oegoconia caradjai PG. & Cap.,2007,6/29/07,2007-07-08,1
336,LEPIDOPTERA,AUTOSTICHIDAE,Oegoconia caradjai PG. & Cap.,2007,7/9/07,2007-07-18,1
337,LEPIDOPTERA,AUTOSTICHIDAE,Oegoconia caradjai PG. & Cap.,2007,7/19/07,2007-07-25,2
338,LEPIDOPTERA,AUTOSTICHIDAE,Oegoconia caradjai PG. & Cap.,2007,8/9/07,2007-08-13,6
339,LEPIDOPTERA,AUTOSTICHIDAE,Oegoconia caradjai PG. & Cap.,2007,8/14/07,2007-08-19,1
340,LEPIDOPTERA,AUTOSTICHIDAE,Oegoconia caradjai PG. & Cap.,2008,6/17/08,2008-06-22,1
341,LEPIDOPTERA,AUTOSTICHIDAE,Oegoconia caradjai PG. & Cap.,2008,7/3/08,2008-07-08,2
342,LEPIDOPTERA,AUTOSTICHIDAE,Oegoconia caradjai PG. & Cap.,2008,7/11/08,2008-07-23,1
343,LEPIDOPTERA,AUTOSTICHIDAE,Oegoconia caradjai PG. & Cap.,2008,8/4/08,2008-08-07,1
344,LEPIDOPTERA,AUTOSTICHIDAE,Oegoconia caradjai PG. & Cap.,2008,8/15/08,2008-08-18,1
345,LEPIDOPTERA,AUTOSTICHIDAE,Oegoconia caradjai PG. & Cap.,2009,5/20/09,2009-06-02,3
346,LEPIDOPTERA,AUTOSTICHIDAE,Oegoconia caradjai PG. & Cap.,2009,6/3/09,2009-06-18,1
347,LEPIDOPTERA,AUTOSTICHIDAE,Oegoconia caradjai PG. & Cap.,2009,7/3/09,2009-07-10,4
348,LEPIDOPTERA,AUTOSTICHIDAE,Oegoconia caradjai PG. & Cap.,2009,7/11/09,2009-07-20,2
349,LEPIDOPTERA,AUTOSTICHIDAE,Oegoconia caradjai PG. & Cap.,2009,7/21/09,2009-07-27,1
350,LEPIDOPTERA,AUTOSTICHIDAE,Oegoconia caradjai PG. & Cap.,2009,7/28/09,2009-08-02,6
351,LEPIDOPTERA,AUTOSTICHIDAE,Oegoconia caradjai PG. & Cap.,2009,8/3/09,2009-08-06,4
352,LEPIDOPTERA,AUTOSTICHIDAE,Oegoconia caradjai PG. & Cap.,2009,8/10/09,2009-08-16,5
353,LEPIDOPTERA,AUTOSTICHIDAE,Oegoconia caradjai PG. & Cap.,2009,8/21/09,2009-08-25,3
354,LEPIDOPTERA,AUTOSTICHIDAE,Oegoconia deauratella HS.,1995,8/1/95,1995-08-01,1
355,LEPIDOPTERA,AUTOSTICHIDAE,Oegoconia deauratella HS.,1998,7/24/98,1998-07-26,1
356,LEPIDOPTERA,AUTOSTICHIDAE,Oegoconia deauratella HS.,2000,8/4/00,2000-08-13,1
357,LEPIDOPTERA,AUTOSTICHIDAE,Oegoconia deauratella HS.,2001,7/30/01,2001-08-02,1
358,LEPIDOPTERA,BATRACHEDRIDAE,Batrachedra pinicolella Zell.,1992,7/3/92,1992-07-05,1
359,LEPIDOPTERA,BATRACHEDRIDAE,Batrachedra pinicolella Zell.,1992,7/6/92,1992-07-08,1
360,LEPIDOPTERA,BATRACHEDRIDAE,Batrachedra pinicolella Zell.,1992,7/10/92,1992-07-12,1
361,LEPIDOPTERA,BATRACHEDRIDAE,Batrachedra pinicolella Zell.,1992,7/17/92,1992-07-20,1
362,LEPIDOPTERA,BATRACHEDRIDAE,Batrachedra pinicolella Zell.,1993,6/28/93,1993-06-30,2
363,LEPIDOPTERA,BATRACHEDRIDAE,Batrachedra pinicolella Zell.,1994,7/7/94,1994-07-11,3
364,LEPIDOPTERA,BATRACHEDRIDAE,Batrachedra pinicolella Zell.,1994,7/12/94,1994-07-14,2
365,LEPIDOPTERA,BATRACHEDRIDAE,Batrachedra pinicolella Zell.,1994,7/15/94,1994-07-17,5
366,LEPIDOPTERA,BATRACHEDRIDAE,Batrachedra pinicolella Zell.,1994,7/18/94,1994-07-19,1
367,LEPIDOPTERA,BATRACHEDRIDAE,Batrachedra pinicolella Zell.,1995,7/10/95,1995-07-13,2
368,LEPIDOPTERA,BATRACHEDRIDAE,Batrachedra pinicolella Zell.,1995,7/14/95,1995-07-17,4
369,LEPIDOPTERA,BATRACHEDRIDAE,Batrachedra pinicolella Zell.,1995,7/18/95,1995-07-20,4
370,LEPIDOPTERA,BATRACHEDRIDAE,Batrachedra pinicolella Zell.,1995,7/21/95,1995-07-21,2
371,LEPIDOPTERA,BATRACHEDRIDAE,Batrachedra pinicolella Zell.,1995,7/22/95,1995-07-24,1
372,LEPIDOPTERA,BATRACHEDRIDAE,Batrachedra pinicolella Zell.,1996,7/12/96,1996-07-17,1
373,LEPIDOPTERA,BATRACHEDRIDAE,Batrachedra pinicolella Zell.,1996,7/24/96,1996-07-25,3
374,LEPIDOPTERA,BATRACHEDRIDAE,Batrachedra pinicolella Zell.,1996,7/30/96,1996-08-01,1
375,LEPIDOPTERA,BATRACHEDRIDAE,Batrachedra pinicolella Zell.,1997,7/4/97,1997-07-06,1
376,LEPIDOPTERA,BATRACHEDRIDAE,Batrachedra pinicolella Zell.,1997,7/7/97,1997-07-08,2
377,LEPIDOPTERA,BATRACHEDRIDAE,Batrachedra pinicolella Zell.,1997,7/9/97,1997-07-10,3
378,LEPIDOPTERA,BATRACHEDRIDAE,Batrachedra pinicolella Zell.,1997,7/16/97,1997-07-20,1
379,LEPIDOPTERA,BATRACHEDRIDAE,Batrachedra pinicolella Zell.,1997,7/21/97,1997-07-21,1
380,LEPIDOPTERA,BATRACHEDRIDAE,Batrachedra pinicolella Zell.,1997,7/22/97,1997-07-23,2
381,LEPIDOPTERA,BATRACHEDRIDAE,Batrachedra pinicolella Zell.,1998,7/9/98,1998-07-12,3
382,LEPIDOPTERA,BATRACHEDRIDAE,Batrachedra pinicolella Zell.,1998,7/22/98,1998-07-23,2
383,LEPIDOPTERA,BATRACHEDRIDAE,Batrachedra pinicolella Zell.,1998,9/1/98,1998-09-10,1
384,LEPIDOPTERA,BATRACHEDRIDAE,Batrachedra pinicolella Zell.,1999,6/30/99,1999-07-01,2
385,LEPIDOPTERA,BATRACHEDRIDAE,Batrachedra pinicolella Zell.,1999,7/2/99,1999-07-04,1
386,LEPIDOPTERA,BATRACHEDRIDAE,Batrachedra pinicolella Zell.,1999,7/7/99,1999-07-08,1
387,LEPIDOPTERA,BATRACHEDRIDAE,Batrachedra pinicolella Zell.,1999,7/9/99,1999-07-11,1
388,LEPIDOPTERA,BATRACHEDRIDAE,Batrachedra pinicolella Zell.,1999,7/12/99,1999-07-19,1
389,LEPIDOPTERA,BATRACHEDRIDAE,Batrachedra pinicolella Zell.,1999,7/20/99,1999-07-21,1
390,LEPIDOPTERA,BATRACHEDRIDAE,Batrachedra pinicolella Zell.,2000,6/16/00,2000-06-21,2
391,LEPIDOPTERA,BATRACHEDRIDAE,Batrachedra pinicolella Zell.,2000,7/12/00,2000-07-18,2
392,LEPIDOPTERA,BATRACHEDRIDAE,Batrachedra pinicolella Zell.,2000,7/21/00,2000-07-24,3
393,LEPIDOPTERA,BATRACHEDRIDAE,Batrachedra pinicolella Zell.,2001,6/28/01,2001-07-01,1
394,LEPIDOPTERA,BATRACHEDRIDAE,Batrachedra pinicolella Zell.,2001,7/4/01,2001-07-08,2
395,LEPIDOPTERA,BATRACHEDRIDAE,Batrachedra pinicolella Zell.,2001,7/20/01,2001-07-23,1
396,LEPIDOPTERA,BATRACHEDRIDAE,Batrachedra pinicolella Zell.,2001,7/24/01,2001-07-25,1
397,LEPIDOPTERA,BATRACHEDRIDAE,Batrachedra pinicolella Zell.,2001,7/26/01,2001-07-29,1
398,LEPIDOPTERA,BATRACHEDRIDAE,Batrachedra pinicolella Zell.,2002,7/4/02,2002-07-07,1
399,LEPIDOPTERA,BATRACHEDRIDAE,Batrachedra pinicolella Zell.,2002,7/8/02,2002-07-11,2
400,LEPIDOPTERA,BATRACHEDRIDAE,Batrachedra pinicolella Zell.,2002,7/12/02,2002-07-15,1
401,LEPIDOPTERA,BATRACHEDRIDAE,Batrachedra pinicolella Zell.,2003,6/16/03,2003-06-22,1
402,LEPIDOPTERA,BATRACHEDRIDAE,Batrachedra pinicolella Zell.,2003,6/23/03,2003-07-10,3
403,LEPIDOPTERA,BATRACHEDRIDAE,Batrachedra pinicolella Zell.,2003,7/11/03,2003-07-14,2
404,LEPIDOPTERA,BATRACHEDRIDAE,Batrachedra pinicolella Zell.,2004,7/15/04,2004-07-18,3
405,LEPIDOPTERA,BATRACHEDRIDAE,Batrachedra pinicolella Zell.,2004,7/22/04,2004-07-25,2
406,LEPIDOPTERA,BATRACHEDRIDAE,Batrachedra pinicolella Zell.,2004,7/30/04,2004-08-01,3
407,LEPIDOPTERA,BATRACHEDRIDAE,Batrachedra pinicolella Zell.,2004,8/18/04,2004-08-22,1
408,LEPIDOPTERA,BATRACHEDRIDAE,Batrachedra pinicolella Zell.,2005,7/7/05,2005-07-07,2
409,LEPIDOPTERA,BATRACHEDRIDAE,Batrachedra pinicolella Zell.,2005,7/8/05,2005-07-10,9
410,LEPIDOPTERA,BATRACHEDRIDAE,Batrachedra pinicolella Zell.,2005,7/11/05,2005-07-11,2
411,LEPIDOPTERA,BATRACHEDRIDAE,Batrachedra pinicolella Zell.,2005,7/12/05,2005-07-14,8
412,LEPIDOPTERA,BATRACHEDRIDAE,Batrachedra pinicolella Zell.,2005,7/15/05,2005-07-17,2
413,LEPIDOPTERA,BATRACHEDRIDAE,Batrachedra pinicolella Zell.,2006,7/7/06,2006-07-09,7
414,LEPIDOPTERA,BATRACHEDRIDAE,Batrachedra pinicolella Zell.,2006,7/10/06,2006-07-13,2
415,LEPIDOPTERA,BATRACHEDRIDAE,Batrachedra pinicolella Zell.,2006,7/14/06,2006-07-20,3
416,LEPIDOPTERA,BATRACHEDRIDAE,Batrachedra pinicolella Zell.,2007,6/11/07,2007-06-12,1
417,LEPIDOPTERA,BATRACHEDRIDAE,Batrachedra pinicolella Zell.,2007,6/13/07,2007-06-17,1
418,LEPIDOPTERA,BATRACHEDRIDAE,Batrachedra pinicolella Zell.,2007,6/18/07,2007-06-21,1
419,LEPIDOPTERA,BATRACHEDRIDAE,Batrachedra pinicolella Zell.,2008,6/17/08,2008-06-22,1
420,LEPIDOPTERA,BATRACHEDRIDAE,Batrachedra pinicolella Zell.,2008,6/26/08,2008-07-02,1
421,LEPIDOPTERA,BATRACHEDRIDAE,Batrachedra pinicolella Zell.,2008,7/3/08,2008-07-08,6
422,LEPIDOPTERA,BATRACHEDRIDAE,Batrachedra pinicolella Zell.,2008,7/9/08,2008-07-10,1
423,LEPIDOPTERA,BATRACHEDRIDAE,Batrachedra pinicolella Zell.,2008,7/11/08,2008-07-23,1
424,LEPIDOPTERA,BATRACHEDRIDAE,Batrachedra pinicolella Zell.,2008,7/24/08,2008-07-28,1
425,LEPIDOPTERA,BATRACHEDRIDAE,Batrachedra pinicolella Zell.,2009,6/29/09,2009-06-29,1
426,LEPIDOPTERA,BATRACHEDRIDAE,Batrachedra pinicolella Zell.,2009,6/30/09,2009-07-02,6
427,LEPIDOPTERA,BATRACHEDRIDAE,Batrachedra pinicolella Zell.,2009,7/3/09,2009-07-10,7
428,LEPIDOPTERA,BATRACHEDRIDAE,Batrachedra pinicolella Zell.,2009,7/11/09,2009-07-20,4
429,LEPIDOPTERA,BATRACHEDRIDAE,Batrachedra pinicolella Zell.,2009,8/3/09,2009-08-06,1
430,LEPIDOPTERA,BATRACHEDRIDAE,Batrachedra pinicolella Zell.,2009,8/21/09,2009-08-25,1
431,LEPIDOPTERA,BATRACHEDRIDAE,Batrachedra praeangusta Hw.,1992,7/10/92,1992-07-12,1
432,LEPIDOPTERA,BATRACHEDRIDAE,Batrachedra praeangusta Hw.,1992,7/13/92,1992-07-16,2
433,LEPIDOPTERA,BATRACHEDRIDAE,Batrachedra praeangusta Hw.,1992,7/17/92,1992-07-20,1
434,LEPIDOPTERA,BATRACHEDRIDAE,Batrachedra praeangusta Hw.,1992,7/21/92,1992-07-23,2
435,LEPIDOPTERA,BATRACHEDRIDAE,Batrachedra praeangusta Hw.,1992,7/24/92,1992-07-28,4
436,LEPIDOPTERA,BATRACHEDRIDAE,Batrachedra praeangusta Hw.,1992,7/29/92,1992-08-02,3
437,LEPIDOPTERA,BATRACHEDRIDAE,Batrachedra praeangusta Hw.,1992,8/3/92,1992-08-05,2
438,LEPIDOPTERA,BATRACHEDRIDAE,Batrachedra praeangusta Hw.,1992,8/24/92,1992-08-27,1
439,LEPIDOPTERA,BATRACHEDRIDAE,Batrachedra praeangusta Hw.,1992,8/28/92,1992-08-31,1
440,LEPIDOPTERA,BATRACHEDRIDAE,Batrachedra praeangusta Hw.,1992,9/7/92,1992-09-13,1
441,LEPIDOPTERA,BATRACHEDRIDAE,Batrachedra praeangusta Hw.,1993,8/26/93,1993-08-31,2
442,LEPIDOPTERA,BATRACHEDRIDAE,Batrachedra praeangusta Hw.,1993,9/6/93,1993-09-15,1
443,LEPIDOPTERA,BATRACHEDRIDAE,Batrachedra praeangusta Hw.,1994,7/18/94,1994-07-19,1
444,LEPIDOPTERA,BATRACHEDRIDAE,Batrachedra praeangusta Hw.,1994,7/20/94,1994-07-21,1
445,LEPIDOPTERA,BATRACHEDRIDAE,Batrachedra praeangusta Hw.,1994,7/22/94,1994-07-24,5
446,LEPIDOPTERA,BATRACHEDRIDAE,Batrachedra praeangusta Hw.,1994,7/25/94,1994-07-26,2
447,LEPIDOPTERA,BATRACHEDRIDAE,Batrachedra praeangusta Hw.,1994,7/27/94,1994-07-27,6
448,LEPIDOPTERA,BATRACHEDRIDAE,Batrachedra praeangusta Hw.,1994,7/28/94,1994-07-28,2
449,LEPIDOPTERA,BATRACHEDRIDAE,Batrachedra praeangusta Hw.,1994,7/29/94,1994-07-31,11
450,LEPIDOPTERA,BATRACHEDRIDAE,Batrachedra praeangusta Hw.,1994,8/2/94,1994-08-04,10
451,LEPIDOPTERA,BATRACHEDRIDAE,Batrachedra praeangusta Hw.,1994,8/5/94,1994-08-07,12
452,LEPIDOPTERA,BATRACHEDRIDAE,Batrachedra praeangusta Hw.,1994,8/8/94,1994-08-09,5
453,LEPIDOPTERA,BATRACHEDRIDAE,Batrachedra praeangusta Hw.,1994,8/10/94,1994-08-11,1
454,LEPIDOPTERA,BATRACHEDRIDAE,Batrachedra praeangusta Hw.,1994,8/12/94,1994-08-21,7
455,LEPIDOPTERA,BATRACHEDRIDAE,Batrachedra praeangusta Hw.,1994,8/22/94,1994-08-25,1
456,LEPIDOPTERA,BATRACHEDRIDAE,Batrachedra praeangusta Hw.,1995,7/18/95,1995-07-20,2
457,LEPIDOPTERA,BATRACHEDRIDAE,Batrachedra praeangusta Hw.,1995,7/22/95,1995-07-24,2
458,LEPIDOPTERA,BATRACHEDRIDAE,Batrachedra praeangusta Hw.,1995,7/30/95,1995-07-30,3
459,LEPIDOPTERA,BATRACHEDRIDAE,Batrachedra praeangusta Hw.,1995,8/1/95,1995-08-01,1
460,LEPIDOPTERA,BATRACHEDRIDAE,Batrachedra praeangusta Hw.,1995,8/2/95,1995-08-02,6
461,LEPIDOPTERA,BATRACHEDRIDAE,Batrachedra praeangusta Hw.,1995,8/3/95,1995-08-03,5
462,LEPIDOPTERA,BATRACHEDRIDAE,Batrachedra praeangusta Hw.,1995,8/4/95,1995-08-05,2
463,LEPIDOPTERA,BATRACHEDRIDAE,Batrachedra praeangusta Hw.,1995,8/6/95,1995-08-06,4
464,LEPIDOPTERA,BATRACHEDRIDAE,Batrachedra praeangusta Hw.,1995,8/7/95,1995-08-07,2
465,LEPIDOPTERA,BATRACHEDRIDAE,Batrachedra praeangusta Hw.,1995,8/8/95,1995-08-09,13
466,LEPIDOPTERA,BATRACHEDRIDAE,Batrachedra praeangusta Hw.,1995,8/10/95,1995-08-13,8
467,LEPIDOPTERA,BATRACHEDRIDAE,Batrachedra praeangusta Hw.,1995,8/14/95,1995-08-16,10
468,LEPIDOPTERA,BATRACHEDRIDAE,Batrachedra praeangusta Hw.,1995,8/17/95,1995-08-17,9
469,LEPIDOPTERA,BATRACHEDRIDAE,Batrachedra praeangusta Hw.,1995,8/18/95,1995-08-18,3
470,LEPIDOPTERA,BATRACHEDRIDAE,Batrachedra praeangusta Hw.,1995,8/19/95,1995-08-20,11
471,LEPIDOPTERA,BATRACHEDRIDAE,Batrachedra praeangusta Hw.,1995,8/21/95,1995-08-23,1
472,LEPIDOPTERA,BATRACHEDRIDAE,Batrachedra praeangusta Hw.,1995,9/1/95,1995-09-12,1
473,LEPIDOPTERA,BATRACHEDRIDAE,Batrachedra praeangusta Hw.,1996,7/12/96,1996-07-17,1
474,LEPIDOPTERA,BATRACHEDRIDAE,Batrachedra praeangusta Hw.,1996,7/18/96,1996-07-23,2
475,LEPIDOPTERA,BATRACHEDRIDAE,Batrachedra praeangusta Hw.,1996,7/24/96,1996-07-25,3
476,LEPIDOPTERA,BATRACHEDRIDAE,Batrachedra praeangusta Hw.,1996,7/26/96,1996-07-29,2
477,LEPIDOPTERA,BATRACHEDRIDAE,Batrachedra praeangusta Hw.,1996,7/30/96,1996-08-01,1
478,LEPIDOPTERA,BATRACHEDRIDAE,Batrachedra praeangusta Hw.,1996,8/2/96,1996-08-08,4
479,LEPIDOPTERA,BATRACHEDRIDAE,Batrachedra praeangusta Hw.,1996,8/14/96,1996-08-15,4
480,LEPIDOPTERA,BATRACHEDRIDAE,Batrachedra praeangusta Hw.,1996,8/16/96,1996-08-18,12
481,LEPIDOPTERA,BATRACHEDRIDAE,Batrachedra praeangusta Hw.,1996,8/19/96,1996-08-20,1
482,LEPIDOPTERA,BATRACHEDRIDAE,Batrachedra praeangusta Hw.,1996,9/3/96,1996-09-09,1
483,LEPIDOPTERA,BATRACHEDRIDAE,Batrachedra praeangusta Hw.,1997,7/25/97,1997-07-27,1
484,LEPIDOPTERA,BATRACHEDRIDAE,Batrachedra praeangusta Hw.,1997,8/8/97,1997-08-13,4
485,LEPIDOPTERA,BATRACHEDRIDAE,Batrachedra praeangusta Hw.,1997,8/14/97,1997-08-17,11
486,LEPIDOPTERA,BATRACHEDRIDAE,Batrachedra praeangusta Hw.,1997,8/18/97,1997-08-21,2
487,LEPIDOPTERA,BATRACHEDRIDAE,Batrachedra praeangusta Hw.,1997,8/25/97,1997-08-31,1
488,LEPIDOPTERA,BATRACHEDRIDAE,Batrachedra praeangusta Hw.,1998,7/22/98,1998-07-23,1
489,LEPIDOPTERA,BATRACHEDRIDAE,Batrachedra praeangusta Hw.,1998,7/24/98,1998-07-26,1
490,LEPIDOPTERA,BATRACHEDRIDAE,Batrachedra praeangusta Hw.,1998,8/7/98,1998-08-11,1
491,LEPIDOPTERA,BATRACHEDRIDAE,Batrachedra praeangusta Hw.,1998,8/12/98,1998-08-13,1
492,LEPIDOPTERA,BATRACHEDRIDAE,Batrachedra praeangusta Hw.,1998,8/14/98,1998-08-18,7
493,LEPIDOPTERA,BATRACHEDRIDAE,Batrachedra praeangusta Hw.,1998,8/19/98,1998-08-20,1
494,LEPIDOPTERA,BATRACHEDRIDAE,Batrachedra praeangusta Hw.,1998,8/21/98,1998-08-23,1
495,LEPIDOPTERA,BATRACHEDRIDAE,Batrachedra praeangusta Hw.,1998,8/28/98,1998-08-31,1
496,LEPIDOPTERA,BATRACHEDRIDAE,Batrachedra praeangusta Hw.,1998,9/11/98,1998-09-17,1
497,LEPIDOPTERA,BATRACHEDRIDAE,Batrachedra praeangusta Hw.,1999,7/12/99,1999-07-19,2
498,LEPIDOPTERA,BATRACHEDRIDAE,Batrachedra praeangusta Hw.,1999,8/4/99,1999-08-05,1
499,LEPIDOPTERA,BATRACHEDRIDAE,Batrachedra praeangusta Hw.,1999,8/9/99,1999-08-10,6
500,LEPIDOPTERA,BATRACHEDRIDAE,Batrachedra praeangusta Hw.,1999,8/13/99,1999-08-15,1
501,LEPIDOPTERA,BATRACHEDRIDAE,Batrachedra praeangusta Hw.,1999,8/27/99,1999-08-29,5
502,LEPIDOPTERA,BATRACHEDRIDAE,Batrachedra praeangusta Hw.,2000,7/19/00,2000-07-20,1
503,LEPIDOPTERA,BATRACHEDRIDAE,Batrachedra praeangusta Hw.,2000,7/28/00,2000-07-30,1
504,LEPIDOPTERA,BATRACHEDRIDAE,Batrachedra praeangusta Hw.,2000,8/4/00,2000-08-13,6
505,LEPIDOPTERA,BATRACHEDRIDAE,Batrachedra praeangusta Hw.,2000,8/14/00,2000-08-20,1
506,LEPIDOPTERA,BATRACHEDRIDAE,Batrachedra praeangusta Hw.,2000,8/25/00,2000-08-28,1
507,LEPIDOPTERA,BATRACHEDRIDAE,Batrachedra praeangusta Hw.,2000,8/29/00,2000-08-31,2
508,LEPIDOPTERA,BATRACHEDRIDAE,Batrachedra praeangusta Hw.,2000,9/1/00,2000-09-26,1
509,LEPIDOPTERA,BATRACHEDRIDAE,Batrachedra praeangusta Hw.,2001,7/2/01,2001-07-03,1
510,LEPIDOPTERA,BATRACHEDRIDAE,Batrachedra praeangusta Hw.,2001,7/9/01,2001-07-12,1
511,LEPIDOPTERA,BATRACHEDRIDAE,Batrachedra praeangusta Hw.,2001,7/17/01,2001-07-19,1
512,LEPIDOPTERA,BATRACHEDRIDAE,Batrachedra praeangusta Hw.,2001,7/20/01,2001-07-23,5
513,LEPIDOPTERA,BATRACHEDRIDAE,Batrachedra praeangusta Hw.,2001,7/24/01,2001-07-25,3
514,LEPIDOPTERA,BATRACHEDRIDAE,Batrachedra praeangusta Hw.,2001,7/26/01,2001-07-29,4
515,LEPIDOPTERA,BATRACHEDRIDAE,Batrachedra praeangusta Hw.,2001,7/30/01,2001-08-02,2
516,LEPIDOPTERA,BATRACHEDRIDAE,Batrachedra praeangusta Hw.,2001,8/3/01,2001-08-06,2
517,LEPIDOPTERA,BATRACHEDRIDAE,Batrachedra praeangusta Hw.,2001,8/7/01,2001-08-09,3
518,LEPIDOPTERA,BATRACHEDRIDAE,Batrachedra praeangusta Hw.,2001,8/10/01,2001-08-13,3
519,LEPIDOPTERA,BATRACHEDRIDAE,Batrachedra praeangusta Hw.,2001,8/14/01,2001-08-16,18
520,LEPIDOPTERA,BATRACHEDRIDAE,Batrachedra praeangusta Hw.,2001,8/17/01,2001-08-26,2
521,LEPIDOPTERA,BATRACHEDRIDAE,Batrachedra praeangusta Hw.,2001,8/27/01,2001-09-02,1
522,LEPIDOPTERA,BATRACHEDRIDAE,Batrachedra praeangusta Hw.,2002,7/4/02,2002-07-07,1
523,LEPIDOPTERA,BATRACHEDRIDAE,Batrachedra praeangusta Hw.,2002,7/8/02,2002-07-11,1
524,LEPIDOPTERA,BATRACHEDRIDAE,Batrachedra praeangusta Hw.,2002,7/12/02,2002-07-15,1
525,LEPIDOPTERA,BATRACHEDRIDAE,Batrachedra praeangusta Hw.,2002,7/16/02,2002-07-17,3
526,LEPIDOPTERA,BATRACHEDRIDAE,Batrachedra praeangusta Hw.,2002,7/18/02,2002-07-28,2
527,LEPIDOPTERA,BATRACHEDRIDAE,Batrachedra praeangusta Hw.,2002,7/29/02,2002-07-31,1
528,LEPIDOPTERA,BATRACHEDRIDAE,Batrachedra praeangusta Hw.,2002,8/8/02,2002-08-11,1
529,LEPIDOPTERA,BATRACHEDRIDAE,Batrachedra praeangusta Hw.,2002,8/12/02,2002-08-14,8
530,LEPIDOPTERA,BATRACHEDRIDAE,Batrachedra praeangusta Hw.,2002,8/15/02,2002-08-19,1
531,LEPIDOPTERA,BATRACHEDRIDAE,Batrachedra praeangusta Hw.,2002,8/27/02,2002-08-29,1
532,LEPIDOPTERA,BATRACHEDRIDAE,Batrachedra praeangusta Hw.,2003,7/15/03,2003-07-20,1
533,LEPIDOPTERA,BATRACHEDRIDAE,Batrachedra praeangusta Hw.,2003,7/21/03,2003-07-24,1
534,LEPIDOPTERA,BATRACHEDRIDAE,Batrachedra praeangusta Hw.,2003,7/25/03,2003-07-31,3
535,LEPIDOPTERA,BATRACHEDRIDAE,Batrachedra praeangusta Hw.,2003,8/1/03,2003-08-08,7
536,LEPIDOPTERA,BATRACHEDRIDAE,Batrachedra praeangusta Hw.,2003,8/9/03,2003-08-14,2
537,LEPIDOPTERA,BATRACHEDRIDAE,Batrachedra praeangusta Hw.,2003,8/29/03,2003-09-15,1
538,LEPIDOPTERA,BATRACHEDRIDAE,Batrachedra praeangusta Hw.,2004,7/19/04,2004-07-21,1
539,LEPIDOPTERA,BATRACHEDRIDAE,Batrachedra praeangusta Hw.,2004,7/30/04,2004-08-01,3
540,LEPIDOPTERA,BATRACHEDRIDAE,Batrachedra praeangusta Hw.,2004,8/2/04,2004-08-03,1
541,LEPIDOPTERA,BATRACHEDRIDAE,Batrachedra praeangusta Hw.,2004,8/13/04,2004-08-15,3
542,LEPIDOPTERA,BATRACHEDRIDAE,Batrachedra praeangusta Hw.,2004,8/16/04,2004-08-17,3
543,LEPIDOPTERA,BATRACHEDRIDAE,Batrachedra praeangusta Hw.,2005,7/30/05,2005-08-02,2
544,LEPIDOPTERA,BATRACHEDRIDAE,Batrachedra praeangusta Hw.,2005,8/3/05,2005-08-05,7
545,LEPIDOPTERA,BATRACHEDRIDAE,Batrachedra praeangusta Hw.,2005,8/6/05,2005-08-14,2
546,LEPIDOPTERA,BATRACHEDRIDAE,Batrachedra praeangusta Hw.,2005,8/17/05,2005-08-18,1
547,LEPIDOPTERA,BATRACHEDRIDAE,Batrachedra praeangusta Hw.,2005,8/19/05,2005-08-22,4
548,LEPIDOPTERA,BATRACHEDRIDAE,Batrachedra praeangusta Hw.,2005,8/26/05,2005-08-29,3
549,LEPIDOPTERA,BATRACHEDRIDAE,Batrachedra praeangusta Hw.,2006,7/7/06,2006-07-09,1
550,LEPIDOPTERA,BATRACHEDRIDAE,Batrachedra praeangusta Hw.,2006,7/14/06,2006-07-20,3
551,LEPIDOPTERA,BATRACHEDRIDAE,Batrachedra praeangusta Hw.,2006,7/21/06,2006-07-27,8
552,LEPIDOPTERA,BATRACHEDRIDAE,Batrachedra praeangusta Hw.,2006,7/28/06,2006-08-03,3
553,LEPIDOPTERA,BATRACHEDRIDAE,Batrachedra praeangusta Hw.,2006,8/4/06,2006-08-06,4
554,LEPIDOPTERA,BATRACHEDRIDAE,Batrachedra praeangusta Hw.,2006,8/7/06,2006-08-10,9
555,LEPIDOPTERA,BATRACHEDRIDAE,Batrachedra praeangusta Hw.,2006,8/11/06,2006-08-16,1
556,LEPIDOPTERA,BATRACHEDRIDAE,Batrachedra praeangusta Hw.,2006,8/25/06,2006-08-31,1
557,LEPIDOPTERA,BATRACHEDRIDAE,Batrachedra praeangusta Hw.,2007,7/9/07,2007-07-18,1
558,LEPIDOPTERA,BATRACHEDRIDAE,Batrachedra praeangusta Hw.,2007,8/3/07,2007-08-08,1
559,LEPIDOPTERA,BATRACHEDRIDAE,Batrachedra praeangusta Hw.,2007,8/9/07,2007-08-13,2
560,LEPIDOPTERA,BATRACHEDRIDAE,Batrachedra praeangusta Hw.,2008,7/3/08,2008-07-08,1
561,LEPIDOPTERA,BATRACHEDRIDAE,Batrachedra praeangusta Hw.,2008,7/11/08,2008-07-23,1
562,LEPIDOPTERA,BATRACHEDRIDAE,Batrachedra praeangusta Hw.,2008,7/24/08,2008-07-28,1
563,LEPIDOPTERA,BATRACHEDRIDAE,Batrachedra praeangusta Hw.,2008,7/29/08,2008-08-03,5
564,LEPIDOPTERA,BATRACHEDRIDAE,Batrachedra praeangusta Hw.,2008,8/4/08,2008-08-07,1
565,LEPIDOPTERA,BATRACHEDRIDAE,Batrachedra praeangusta Hw.,2008,8/8/08,2008-08-14,1
566,LEPIDOPTERA,BATRACHEDRIDAE,Batrachedra praeangusta Hw.,2008,8/15/08,2008-08-18,1
567,LEPIDOPTERA,BATRACHEDRIDAE,Batrachedra praeangusta Hw.,2008,8/29/08,2008-09-04,1
568,LEPIDOPTERA,BATRACHEDRIDAE,Batrachedra praeangusta Hw.,2009,6/26/09,2009-06-28,1
569,LEPIDOPTERA,BATRACHEDRIDAE,Batrachedra praeangusta Hw.,2009,7/3/09,2009-07-10,1
570,LEPIDOPTERA,BATRACHEDRIDAE,Batrachedra praeangusta Hw.,2009,7/11/09,2009-07-20,2
571,LEPIDOPTERA,BATRACHEDRIDAE,Batrachedra praeangusta Hw.,2009,7/21/09,2009-07-27,1
572,LEPIDOPTERA,BATRACHEDRIDAE,Batrachedra praeangusta Hw.,2009,7/28/09,2009-08-02,2
573,LEPIDOPTERA,BATRACHEDRIDAE,Batrachedra praeangusta Hw.,2009,8/10/09,2009-08-16,4
574,LEPIDOPTERA,BATRACHEDRIDAE,Batrachedra praeangusta Hw.,2009,8/26/09,2009-08-27,2
575,LEPIDOPTERA,BEDELLIIDAE,Bedellia somnulentella Zell.,2003,6/23/03,2003-07-10,1
576,LEPIDOPTERA,BEDELLIIDAE,Bedellia somnulentella Zell.,2003,8/29/03,2003-09-15,1
577,LEPIDOPTERA,BUCCULATRICIDAE,Bucculatrix bechsteiniella Bechs. & Scharf.,1993,6/1/93,1993-06-06,1
578,LEPIDOPTERA,BUCCULATRICIDAE,Bucculatrix bechsteiniella Bechs. & Scharf.,1997,6/9/97,1997-06-12,1
579,LEPIDOPTERA,BUCCULATRICIDAE,Bucculatrix bechsteiniella Bechs. & Scharf.,1997,8/14/97,1997-08-17,3
580,LEPIDOPTERA,BUCCULATRICIDAE,Bucculatrix bechsteiniella Bechs. & Scharf.,1997,8/18/97,1997-08-21,2
581,LEPIDOPTERA,BUCCULATRICIDAE,Bucculatrix bechsteiniella Bechs. & Scharf.,1999,5/26/99,1999-05-30,1
582,LEPIDOPTERA,BUCCULATRICIDAE,Bucculatrix bechsteiniella Bechs. & Scharf.,2000,5/11/00,2000-05-16,1
583,LEPIDOPTERA,BUCCULATRICIDAE,Bucculatrix bechsteiniella Bechs. & Scharf.,2003,6/2/03,2003-06-09,2
584,LEPIDOPTERA,BUCCULATRICIDAE,Bucculatrix bechsteiniella Bechs. & Scharf.,2005,5/25/05,2005-05-29,1
585,LEPIDOPTERA,BUCCULATRICIDAE,Bucculatrix bechsteiniella Bechs. & Scharf.,2006,6/14/06,2006-06-20,2
586,LEPIDOPTERA,BUCCULATRICIDAE,Bucculatrix bechsteiniella Bechs. & Scharf.,2006,7/21/06,2006-07-27,1
587,LEPIDOPTERA,BUCCULATRICIDAE,Bucculatrix bechsteiniella Bechs. & Scharf.,2009,7/21/09,2009-07-27,1
588,LEPIDOPTERA,BUCCULATRICIDAE,Bucculatrix bechsteiniella Bechs. & Scharf.,2009,7/28/09,2009-08-02,2
589,LEPIDOPTERA,BUCCULATRICIDAE,Bucculatrix bechsteiniella Bechs. & Scharf.,2009,8/3/09,2009-08-06,2
590,LEPIDOPTERA,BUCCULATRICIDAE,Bucculatrix cristatella Zell.,2006,7/28/06,2006-08-03,1
591,LEPIDOPTERA,BUCCULATRICIDAE,Bucculatrix maritima Stt.,1997,8/18/97,1997-08-21,2
592,LEPIDOPTERA,BUCCULATRICIDAE,Bucculatrix maritima Stt.,1999,8/6/99,1999-08-08,1
593,LEPIDOPTERA,BUCCULATRICIDAE,Bucculatrix maritima Stt.,2001,8/14/01,2001-08-16,1
594,LEPIDOPTERA,BUCCULATRICIDAE,Bucculatrix maritima Stt.,2007,8/9/07,2007-08-13,1
595,LEPIDOPTERA,BUCCULATRICIDAE,Bucculatrix nigricomella Zell.,2001,8/17/01,2001-08-26,1
596,LEPIDOPTERA,BUCCULATRICIDAE,Bucculatrix nigricomella Zell.,2002,8/1/02,2002-08-04,1
597,LEPIDOPTERA,BUCCULATRICIDAE,Bucculatrix nigricomella Zell.,2003,8/19/03,2003-08-28,1
598,LEPIDOPTERA,BUCCULATRICIDAE,Bucculatrix nigricomella Zell.,2009,7/11/09,2009-07-20,1
599,LEPIDOPTERA,BUCCULATRICIDAE,Bucculatrix thoracella Thbg.,1992,7/6/92,1992-07-08,3
600,LEPIDOPTERA,BUCCULATRICIDAE,Bucculatrix thoracella Thbg.,1992,7/13/92,1992-07-16,1
601,LEPIDOPTERA,BUCCULATRICIDAE,Bucculatrix thoracella Thbg.,1992,7/17/92,1992-07-20,5
602,LEPIDOPTERA,BUCCULATRICIDAE,Bucculatrix thoracella Thbg.,1992,7/21/92,1992-07-23,1
603,LEPIDOPTERA,BUCCULATRICIDAE,Bucculatrix thoracella Thbg.,1992,8/3/92,1992-08-05,1
604,LEPIDOPTERA,BUCCULATRICIDAE,Bucculatrix thoracella Thbg.,1993,5/17/93,1993-05-23,1
605,LEPIDOPTERA,BUCCULATRICIDAE,Bucculatrix thoracella Thbg.,1994,7/25/94,1994-07-26,1
606,LEPIDOPTERA,BUCCULATRICIDAE,Bucculatrix thoracella Thbg.,1995,7/21/95,1995-07-21,1
607,LEPIDOPTERA,BUCCULATRICIDAE,Bucculatrix thoracella Thbg.,1995,8/1/95,1995-08-01,1
608,LEPIDOPTERA,BUCCULATRICIDAE,Bucculatrix thoracella Thbg.,1995,8/2/95,1995-08-02,1
609,LEPIDOPTERA,BUCCULATRICIDAE,Bucculatrix thoracella Thbg.,1995,8/3/95,1995-08-03,2
610,LEPIDOPTERA,BUCCULATRICIDAE,Bucculatrix thoracella Thbg.,1995,8/6/95,1995-08-06,2
611,LEPIDOPTERA,BUCCULATRICIDAE,Bucculatrix thoracella Thbg.,1995,8/10/95,1995-08-13,3
612,LEPIDOPTERA,BUCCULATRICIDAE,Bucculatrix thoracella Thbg.,1995,8/14/95,1995-08-16,1
613,LEPIDOPTERA,BUCCULATRICIDAE,Bucculatrix thoracella Thbg.,1997,8/1/97,1997-08-03,2
614,LEPIDOPTERA,BUCCULATRICIDAE,Bucculatrix thoracella Thbg.,1997,8/8/97,1997-08-13,3
615,LEPIDOPTERA,BUCCULATRICIDAE,Bucculatrix thoracella Thbg.,1997,8/14/97,1997-08-17,3
616,LEPIDOPTERA,BUCCULATRICIDAE,Bucculatrix thoracella Thbg.,1997,8/18/97,1997-08-21,1
617,LEPIDOPTERA,BUCCULATRICIDAE,Bucculatrix thoracella Thbg.,1998,8/7/98,1998-08-11,1
618,LEPIDOPTERA,BUCCULATRICIDAE,Bucculatrix thoracella Thbg.,1998,8/14/98,1998-08-18,1
619,LEPIDOPTERA,BUCCULATRICIDAE,Bucculatrix thoracella Thbg.,1999,8/4/99,1999-08-05,1
620,LEPIDOPTERA,BUCCULATRICIDAE,Bucculatrix thoracella Thbg.,1999,8/6/99,1999-08-08,8
621,LEPIDOPTERA,BUCCULATRICIDAE,Bucculatrix thoracella Thbg.,1999,8/9/99,1999-08-10,1
622,LEPIDOPTERA,BUCCULATRICIDAE,Bucculatrix thoracella Thbg.,1999,8/19/99,1999-08-22,1
623,LEPIDOPTERA,BUCCULATRICIDAE,Bucculatrix thoracella Thbg.,2000,5/11/00,2000-05-16,1
624,LEPIDOPTERA,BUCCULATRICIDAE,Bucculatrix thoracella Thbg.,2001,5/10/01,2001-05-21,1
625,LEPIDOPTERA,BUCCULATRICIDAE,Bucculatrix thoracella Thbg.,2001,7/26/01,2001-07-29,1
626,LEPIDOPTERA,BUCCULATRICIDAE,Bucculatrix thoracella Thbg.,2001,7/30/01,2001-08-02,1
627,LEPIDOPTERA,BUCCULATRICIDAE,Bucculatrix thoracella Thbg.,2001,8/14/01,2001-08-16,3
628,LEPIDOPTERA,BUCCULATRICIDAE,Bucculatrix thoracella Thbg.,2002,7/12/02,2002-07-15,1
629,LEPIDOPTERA,BUCCULATRICIDAE,Bucculatrix thoracella Thbg.,2003,5/21/03,2003-05-26,2
630,LEPIDOPTERA,BUCCULATRICIDAE,Bucculatrix thoracella Thbg.,2003,7/15/03,2003-07-20,1
631,LEPIDOPTERA,BUCCULATRICIDAE,Bucculatrix thoracella Thbg.,2003,7/25/03,2003-07-31,1
632,LEPIDOPTERA,BUCCULATRICIDAE,Bucculatrix thoracella Thbg.,2003,8/1/03,2003-08-08,7
633,LEPIDOPTERA,BUCCULATRICIDAE,Bucculatrix thoracella Thbg.,2003,8/9/03,2003-08-14,2
634,LEPIDOPTERA,BUCCULATRICIDAE,Bucculatrix thoracella Thbg.,2004,7/30/04,2004-08-01,1
635,LEPIDOPTERA,BUCCULATRICIDAE,Bucculatrix thoracella Thbg.,2004,8/16/04,2004-08-17,1
636,LEPIDOPTERA,BUCCULATRICIDAE,Bucculatrix thoracella Thbg.,2009,8/10/09,2009-08-16,1
637,LEPIDOPTERA,BUCCULATRICIDAE,Bucculatrix ulmella Zell.,1992,7/17/92,1992-07-20,1
638,LEPIDOPTERA,BUCCULATRICIDAE,Bucculatrix ulmella Zell.,1992,7/29/92,1992-08-02,1
639,LEPIDOPTERA,BUCCULATRICIDAE,Bucculatrix ulmella Zell.,1992,8/3/92,1992-08-05,1
640,LEPIDOPTERA,BUCCULATRICIDAE,Bucculatrix ulmella Zell.,1992,8/6/92,1992-08-09,1
641,LEPIDOPTERA,BUCCULATRICIDAE,Bucculatrix ulmella Zell.,1992,8/10/92,1992-08-12,1
642,LEPIDOPTERA,BUCCULATRICIDAE,Bucculatrix ulmella Zell.,1993,5/17/93,1993-05-23,1
643,LEPIDOPTERA,BUCCULATRICIDAE,Bucculatrix ulmella Zell.,1993,6/1/93,1993-06-06,3
644,LEPIDOPTERA,BUCCULATRICIDAE,Bucculatrix ulmella Zell.,1993,6/7/93,1993-06-10,1
645,LEPIDOPTERA,BUCCULATRICIDAE,Bucculatrix ulmella Zell.,1993,6/11/93,1993-06-14,1
646,LEPIDOPTERA,BUCCULATRICIDAE,Bucculatrix ulmella Zell.,1993,8/26/93,1993-08-31,1
647,LEPIDOPTERA,BUCCULATRICIDAE,Bucculatrix ulmella Zell.,1994,6/8/94,1994-06-13,1
648,LEPIDOPTERA,BUCCULATRICIDAE,Bucculatrix ulmella Zell.,1994,7/25/94,1994-07-26,1
649,LEPIDOPTERA,BUCCULATRICIDAE,Bucculatrix ulmella Zell.,1994,8/22/94,1994-08-25,1
650,LEPIDOPTERA,BUCCULATRICIDAE,Bucculatrix ulmella Zell.,1995,6/20/95,1995-06-25,5
651,LEPIDOPTERA,BUCCULATRICIDAE,Bucculatrix ulmella Zell.,1995,6/26/95,1995-06-27,1
652,LEPIDOPTERA,BUCCULATRICIDAE,Bucculatrix ulmella Zell.,1995,8/3/95,1995-08-03,3
653,LEPIDOPTERA,BUCCULATRICIDAE,Bucculatrix ulmella Zell.,1995,8/6/95,1995-08-06,10
654,LEPIDOPTERA,BUCCULATRICIDAE,Bucculatrix ulmella Zell.,1995,8/7/95,1995-08-07,1
655,LEPIDOPTERA,BUCCULATRICIDAE,Bucculatrix ulmella Zell.,1995,8/8/95,1995-08-09,1
656,LEPIDOPTERA,BUCCULATRICIDAE,Bucculatrix ulmella Zell.,1995,8/10/95,1995-08-13,8
657,LEPIDOPTERA,BUCCULATRICIDAE,Bucculatrix ulmella Zell.,1995,8/14/95,1995-08-16,5
658,LEPIDOPTERA,BUCCULATRICIDAE,Bucculatrix ulmella Zell.,1995,8/17/95,1995-08-17,1
659,LEPIDOPTERA,BUCCULATRICIDAE,Bucculatrix ulmella Zell.,1995,8/19/95,1995-08-20,2
660,LEPIDOPTERA,BUCCULATRICIDAE,Bucculatrix ulmella Zell.,1996,6/13/96,1996-06-20,2
661,LEPIDOPTERA,BUCCULATRICIDAE,Bucculatrix ulmella Zell.,1996,7/5/96,1996-07-11,2
662,LEPIDOPTERA,BUCCULATRICIDAE,Bucculatrix ulmella Zell.,1996,7/12/96,1996-07-17,1
663,LEPIDOPTERA,BUCCULATRICIDAE,Bucculatrix ulmella Zell.,1996,8/14/96,1996-08-15,1
664,LEPIDOPTERA,BUCCULATRICIDAE,Bucculatrix ulmella Zell.,1996,8/16/96,1996-08-18,3
665,LEPIDOPTERA,BUCCULATRICIDAE,Bucculatrix ulmella Zell.,1997,5/30/97,1997-06-03,1
666,LEPIDOPTERA,BUCCULATRICIDAE,Bucculatrix ulmella Zell.,1997,6/24/97,1997-06-30,1
667,LEPIDOPTERA,BUCCULATRICIDAE,Bucculatrix ulmella Zell.,1997,7/28/97,1997-07-31,2
668,LEPIDOPTERA,BUCCULATRICIDAE,Bucculatrix ulmella Zell.,1997,8/4/97,1997-08-07,1
669,LEPIDOPTERA,BUCCULATRICIDAE,Bucculatrix ulmella Zell.,1997,8/8/97,1997-08-13,1
670,LEPIDOPTERA,BUCCULATRICIDAE,Bucculatrix ulmella Zell.,1997,8/14/97,1997-08-17,3
671,LEPIDOPTERA,BUCCULATRICIDAE,Bucculatrix ulmella Zell.,1998,5/19/98,1998-05-26,1
672,LEPIDOPTERA,BUCCULATRICIDAE,Bucculatrix ulmella Zell.,1998,6/2/98,1998-06-07,1
673,LEPIDOPTERA,BUCCULATRICIDAE,Bucculatrix ulmella Zell.,1998,6/8/98,1998-06-11,2
674,LEPIDOPTERA,BUCCULATRICIDAE,Bucculatrix ulmella Zell.,1998,6/15/98,1998-06-18,2
675,LEPIDOPTERA,BUCCULATRICIDAE,Bucculatrix ulmella Zell.,1998,8/7/98,1998-08-11,2
676,LEPIDOPTERA,BUCCULATRICIDAE,Bucculatrix ulmella Zell.,1998,8/14/98,1998-08-18,2
677,LEPIDOPTERA,BUCCULATRICIDAE,Bucculatrix ulmella Zell.,1998,8/19/98,1998-08-20,3
678,LEPIDOPTERA,BUCCULATRICIDAE,Bucculatrix ulmella Zell.,1998,8/24/98,1998-08-27,1
679,LEPIDOPTERA,BUCCULATRICIDAE,Bucculatrix ulmella Zell.,1999,5/26/99,1999-05-30,1
680,LEPIDOPTERA,BUCCULATRICIDAE,Bucculatrix ulmella Zell.,1999,8/4/99,1999-08-05,1
681,LEPIDOPTERA,BUCCULATRICIDAE,Bucculatrix ulmella Zell.,1999,8/6/99,1999-08-08,1
682,LEPIDOPTERA,BUCCULATRICIDAE,Bucculatrix ulmella Zell.,1999,8/9/99,1999-08-10,2
683,LEPIDOPTERA,BUCCULATRICIDAE,Bucculatrix ulmella Zell.,1999,8/11/99,1999-08-12,2
684,LEPIDOPTERA,BUCCULATRICIDAE,Bucculatrix ulmella Zell.,2000,5/4/00,2000-05-10,3
685,LEPIDOPTERA,BUCCULATRICIDAE,Bucculatrix ulmella Zell.,2000,5/11/00,2000-05-16,6
686,LEPIDOPTERA,BUCCULATRICIDAE,Bucculatrix ulmella Zell.,2000,6/16/00,2000-06-21,2
687,LEPIDOPTERA,BUCCULATRICIDAE,Bucculatrix ulmella Zell.,2000,7/28/00,2000-07-30,1
688,LEPIDOPTERA,BUCCULATRICIDAE,Bucculatrix ulmella Zell.,2000,8/2/00,2000-08-03,1
689,LEPIDOPTERA,BUCCULATRICIDAE,Bucculatrix ulmella Zell.,2000,8/14/00,2000-08-20,5
690,LEPIDOPTERA,BUCCULATRICIDAE,Bucculatrix ulmella Zell.,2000,8/21/00,2000-08-24,2
691,LEPIDOPTERA,BUCCULATRICIDAE,Bucculatrix ulmella Zell.,2000,9/1/00,2000-09-26,2
692,LEPIDOPTERA,BUCCULATRICIDAE,Bucculatrix ulmella Zell.,2001,5/22/01,2001-05-31,1
693,LEPIDOPTERA,BUCCULATRICIDAE,Bucculatrix ulmella Zell.,2001,6/20/01,2001-06-24,2
694,LEPIDOPTERA,BUCCULATRICIDAE,Bucculatrix ulmella Zell.,2001,6/28/01,2001-07-01,1
695,LEPIDOPTERA,BUCCULATRICIDAE,Bucculatrix ulmella Zell.,2001,7/2/01,2001-07-03,1
696,LEPIDOPTERA,BUCCULATRICIDAE,Bucculatrix ulmella Zell.,2001,7/24/01,2001-07-25,1
697,LEPIDOPTERA,BUCCULATRICIDAE,Bucculatrix ulmella Zell.,2001,7/26/01,2001-07-29,1
698,LEPIDOPTERA,BUCCULATRICIDAE,Bucculatrix ulmella Zell.,2001,8/14/01,2001-08-16,5
699,LEPIDOPTERA,BUCCULATRICIDAE,Bucculatrix ulmella Zell.,2001,8/17/01,2001-08-26,1
700,LEPIDOPTERA,BUCCULATRICIDAE,Bucculatrix ulmella Zell.,2002,5/13/02,2002-05-23,1
701,LEPIDOPTERA,BUCCULATRICIDAE,Bucculatrix ulmella Zell.,2002,5/24/02,2002-05-28,1
702,LEPIDOPTERA,BUCCULATRICIDAE,Bucculatrix ulmella Zell.,2002,6/1/02,2002-06-10,2
703,LEPIDOPTERA,BUCCULATRICIDAE,Bucculatrix ulmella Zell.,2002,6/11/02,2002-06-16,3
704,LEPIDOPTERA,BUCCULATRICIDAE,Bucculatrix ulmella Zell.,2002,7/16/02,2002-07-17,1
705,LEPIDOPTERA,BUCCULATRICIDAE,Bucculatrix ulmella Zell.,2002,7/18/02,2002-07-28,1
706,LEPIDOPTERA,BUCCULATRICIDAE,Bucculatrix ulmella Zell.,2002,8/5/02,2002-08-07,1
707,LEPIDOPTERA,BUCCULATRICIDAE,Bucculatrix ulmella Zell.,2002,8/12/02,2002-08-14,6
708,LEPIDOPTERA,BUCCULATRICIDAE,Bucculatrix ulmella Zell.,2002,8/15/02,2002-08-19,4
709,LEPIDOPTERA,BUCCULATRICIDAE,Bucculatrix ulmella Zell.,2002,8/27/02,2002-08-29,1
710,LEPIDOPTERA,BUCCULATRICIDAE,Bucculatrix ulmella Zell.,2002,8/30/02,2002-09-04,1
711,LEPIDOPTERA,BUCCULATRICIDAE,Bucculatrix ulmella Zell.,2003,5/21/03,2003-05-26,3
712,LEPIDOPTERA,BUCCULATRICIDAE,Bucculatrix ulmella Zell.,2003,5/27/03,2003-06-01,4
713,LEPIDOPTERA,BUCCULATRICIDAE,Bucculatrix ulmella Zell.,2003,6/2/03,2003-06-09,2
714,LEPIDOPTERA,BUCCULATRICIDAE,Bucculatrix ulmella Zell.,2003,6/10/03,2003-06-15,2
715,LEPIDOPTERA,BUCCULATRICIDAE,Bucculatrix ulmella Zell.,2003,8/1/03,2003-08-08,10
716,LEPIDOPTERA,BUCCULATRICIDAE,Bucculatrix ulmella Zell.,2003,8/9/03,2003-08-14,6
717,LEPIDOPTERA,BUCCULATRICIDAE,Bucculatrix ulmella Zell.,2003,8/19/03,2003-08-28,2
718,LEPIDOPTERA,BUCCULATRICIDAE,Bucculatrix ulmella Zell.,2004,6/8/04,2004-06-10,1
719,LEPIDOPTERA,BUCCULATRICIDAE,Bucculatrix ulmella Zell.,2004,7/28/04,2004-07-29,1
720,LEPIDOPTERA,BUCCULATRICIDAE,Bucculatrix ulmella Zell.,2004,7/30/04,2004-08-01,1
721,LEPIDOPTERA,BUCCULATRICIDAE,Bucculatrix ulmella Zell.,2004,8/6/04,2004-08-08,1
722,LEPIDOPTERA,BUCCULATRICIDAE,Bucculatrix ulmella Zell.,2005,6/18/05,2005-06-21,1
723,LEPIDOPTERA,BUCCULATRICIDAE,Bucculatrix ulmella Zell.,2005,6/22/05,2005-06-26,2
724,LEPIDOPTERA,BUCCULATRICIDAE,Bucculatrix ulmella Zell.,2005,7/30/05,2005-08-02,1
725,LEPIDOPTERA,BUCCULATRICIDAE,Bucculatrix ulmella Zell.,2005,8/3/05,2005-08-05,1
726,LEPIDOPTERA,BUCCULATRICIDAE,Bucculatrix ulmella Zell.,2005,8/17/05,2005-08-18,1
727,LEPIDOPTERA,BUCCULATRICIDAE,Bucculatrix ulmella Zell.,2005,8/26/05,2005-08-29,2
728,LEPIDOPTERA,BUCCULATRICIDAE,Bucculatrix ulmella Zell.,2006,6/9/06,2006-06-11,1
729,LEPIDOPTERA,BUCCULATRICIDAE,Bucculatrix ulmella Zell.,2006,6/12/06,2006-06-13,1
730,LEPIDOPTERA,BUCCULATRICIDAE,Bucculatrix ulmella Zell.,2006,7/21/06,2006-07-27,6
731,LEPIDOPTERA,BUCCULATRICIDAE,Bucculatrix ulmella Zell.,2006,7/28/06,2006-08-03,1
732,LEPIDOPTERA,BUCCULATRICIDAE,Bucculatrix ulmella Zell.,2006,8/7/06,2006-08-10,1
733,LEPIDOPTERA,BUCCULATRICIDAE,Bucculatrix ulmella Zell.,2006,8/17/06,2006-08-24,2
734,LEPIDOPTERA,BUCCULATRICIDAE,Bucculatrix ulmella Zell.,2007,5/15/07,2007-05-21,5
735,LEPIDOPTERA,BUCCULATRICIDAE,Bucculatrix ulmella Zell.,2007,5/22/07,2007-05-30,5
736,LEPIDOPTERA,BUCCULATRICIDAE,Bucculatrix ulmella Zell.,2007,5/31/07,2007-06-06,1
737,LEPIDOPTERA,BUCCULATRICIDAE,Bucculatrix ulmella Zell.,2007,6/7/07,2007-06-10,10
738,LEPIDOPTERA,BUCCULATRICIDAE,Bucculatrix ulmella Zell.,2007,6/11/07,2007-06-12,2
739,LEPIDOPTERA,BUCCULATRICIDAE,Bucculatrix ulmella Zell.,2007,6/22/07,2007-06-25,1
740,LEPIDOPTERA,BUCCULATRICIDAE,Bucculatrix ulmella Zell.,2007,8/9/07,2007-08-13,8
741,LEPIDOPTERA,BUCCULATRICIDAE,Bucculatrix ulmella Zell.,2007,8/24/07,2007-08-30,2
742,LEPIDOPTERA,BUCCULATRICIDAE,Bucculatrix ulmella Zell.,2007,9/1/07,2007-09-05,1
743,LEPIDOPTERA,BUCCULATRICIDAE,Bucculatrix ulmella Zell.,2007,9/6/07,2007-09-12,2
744,LEPIDOPTERA,BUCCULATRICIDAE,Bucculatrix ulmella Zell.,2008,5/6/08,2008-05-13,1
745,LEPIDOPTERA,BUCCULATRICIDAE,Bucculatrix ulmella Zell.,2008,5/27/08,2008-06-02,1
746,LEPIDOPTERA,BUCCULATRICIDAE,Bucculatrix ulmella Zell.,2008,6/3/08,2008-06-08,1
747,LEPIDOPTERA,BUCCULATRICIDAE,Bucculatrix ulmella Zell.,2008,7/11/08,2008-07-23,2
748,LEPIDOPTERA,BUCCULATRICIDAE,Bucculatrix ulmella Zell.,2008,7/29/08,2008-08-03,6
749,LEPIDOPTERA,BUCCULATRICIDAE,Bucculatrix ulmella Zell.,2008,8/22/08,2008-08-24,1
750,LEPIDOPTERA,BUCCULATRICIDAE,Bucculatrix ulmella Zell.,2008,8/25/08,2008-08-28,2
751,LEPIDOPTERA,BUCCULATRICIDAE,Bucculatrix ulmella Zell.,2009,5/20/09,2009-06-02,4
752,LEPIDOPTERA,BUCCULATRICIDAE,Bucculatrix ulmella Zell.,2009,8/3/09,2009-08-06,1
753,LEPIDOPTERA,BUCCULATRICIDAE,Bucculatrix ulmella Zell.,2009,8/10/09,2009-08-16,1
754,LEPIDOPTERA,CHIMABACHIDAE,Diurnea fagella D. & S.,1996,5/1/96,1996-05-31,1
755,LEPIDOPTERA,CHIMABACHIDAE,Diurnea fagella D. & S.,2003,5/1/03,2003-05-20,1
756,LEPIDOPTERA,CHIMABACHIDAE,Diurnea fagella D. & S.,2006,5/2/06,2006-05-18,1
757,LEPIDOPTERA,CHIMABACHIDAE,Diurnea fagella D. & S.,2007,4/2/07,2007-04-29,1
758,LEPIDOPTERA,CHOREUTIDAE,Anthophila fabriciana L.,2007,9/13/07,2007-09-20,1
759,LEPIDOPTERA,CHOREUTIDAE,Prochoreutis myllerana F.,1997,8/14/97,1997-08-17,1
760,LEPIDOPTERA,CHOREUTIDAE,Prochoreutis myllerana F.,2002,8/27/02,2002-08-29,1
761,LEPIDOPTERA,CHOREUTIDAE,Prochoreutis myllerana F.,2006,7/21/06,2006-07-27,7
762,LEPIDOPTERA,CHOREUTIDAE,Prochoreutis myllerana F.,2006,8/4/06,2006-08-06,1
763,LEPIDOPTERA,CHOREUTIDAE,Prochoreutis myllerana F.,2006,8/11/06,2006-08-16,1
764,LEPIDOPTERA,COLEOPHORIDAE,Coleophora adjunctella Hodgk.,1994,7/7/94,1994-07-11,1
765,LEPIDOPTERA,COLEOPHORIDAE,Coleophora adjunctella Hodgk.,1996,7/12/96,1996-07-17,1
766,LEPIDOPTERA,COLEOPHORIDAE,Coleophora adjunctella Hodgk.,1996,7/24/96,1996-07-25,1
767,LEPIDOPTERA,COLEOPHORIDAE,Coleophora adjunctella Hodgk.,1997,6/24/97,1997-06-30,2
768,LEPIDOPTERA,COLEOPHORIDAE,Coleophora adjunctella Hodgk.,2000,6/16/00,2000-06-21,2
769,LEPIDOPTERA,COLEOPHORIDAE,Coleophora adjunctella Hodgk.,2000,7/3/00,2000-07-06,1
770,LEPIDOPTERA,COLEOPHORIDAE,Coleophora adspersella Ben.,1992,6/29/92,1992-07-02,1
771,LEPIDOPTERA,COLEOPHORIDAE,Coleophora adspersella Ben.,1999,7/9/99,1999-07-11,1
772,LEPIDOPTERA,COLEOPHORIDAE,Coleophora adspersella Ben.,2000,7/7/00,2000-07-11,1
773,LEPIDOPTERA,COLEOPHORIDAE,Coleophora adspersella Ben.,2007,6/29/07,2007-07-08,1
774,LEPIDOPTERA,COLEOPHORIDAE,Coleophora adspersella Ben.,2007,7/9/07,2007-07-18,2
775,LEPIDOPTERA,COLEOPHORIDAE,Coleophora adspersella Ben.,2007,7/26/07,2007-07-31,1
776,LEPIDOPTERA,COLEOPHORIDAE,Coleophora alcyonipennella Koll.,1994,7/29/94,1994-07-31,2
777,LEPIDOPTERA,COLEOPHORIDAE,Coleophora alcyonipennella Koll.,1995,8/6/95,1995-08-06,1
778,LEPIDOPTERA,COLEOPHORIDAE,Coleophora alcyonipennella Koll.,1995,8/7/95,1995-08-07,1
779,LEPIDOPTERA,COLEOPHORIDAE,Coleophora alcyonipennella Koll.,1995,8/19/95,1995-08-20,1
780,LEPIDOPTERA,COLEOPHORIDAE,Coleophora alcyonipennella Koll.,1996,8/14/96,1996-08-15,1
781,LEPIDOPTERA,COLEOPHORIDAE,Coleophora alcyonipennella Koll.,1996,8/16/96,1996-08-18,2
782,LEPIDOPTERA,COLEOPHORIDAE,Coleophora alcyonipennella Koll.,1997,8/1/97,1997-08-03,1
783,LEPIDOPTERA,COLEOPHORIDAE,Coleophora alcyonipennella Koll.,1997,8/25/97,1997-08-31,1
784,LEPIDOPTERA,COLEOPHORIDAE,Coleophora alcyonipennella Koll.,2001,7/26/01,2001-07-29,1
785,LEPIDOPTERA,COLEOPHORIDAE,Coleophora alcyonipennella Koll.,2001,8/14/01,2001-08-16,1
786,LEPIDOPTERA,COLEOPHORIDAE,Coleophora alcyonipennella Koll.,2001,8/17/01,2001-08-26,1
787,LEPIDOPTERA,COLEOPHORIDAE,Coleophora alcyonipennella Koll.,2003,7/21/03,2003-07-24,1
788,LEPIDOPTERA,COLEOPHORIDAE,Coleophora alcyonipennella Koll.,2003,7/25/03,2003-07-31,1
789,LEPIDOPTERA,COLEOPHORIDAE,Coleophora alcyonipennella Koll.,2003,8/1/03,2003-08-08,7
790,LEPIDOPTERA,COLEOPHORIDAE,Coleophora alcyonipennella Koll.,2003,8/9/03,2003-08-14,6
791,LEPIDOPTERA,COLEOPHORIDAE,Coleophora alcyonipennella Koll.,2003,8/15/03,2003-08-18,1
792,LEPIDOPTERA,COLEOPHORIDAE,Coleophora alcyonipennella Koll.,2003,8/29/03,2003-09-15,1
793,LEPIDOPTERA,COLEOPHORIDAE,Coleophora alcyonipennella Koll.,2005,7/1/05,2005-07-03,1
794,LEPIDOPTERA,COLEOPHORIDAE,Coleophora alcyonipennella Koll.,2005,7/18/05,2005-07-19,2
795,LEPIDOPTERA,COLEOPHORIDAE,Coleophora alcyonipennella Koll.,2005,7/20/05,2005-07-21,2
796,LEPIDOPTERA,COLEOPHORIDAE,Coleophora alcyonipennella Koll.,2005,7/22/05,2005-07-26,1
797,LEPIDOPTERA,COLEOPHORIDAE,Coleophora alcyonipennella Koll.,2005,8/6/05,2005-08-14,3
798,LEPIDOPTERA,COLEOPHORIDAE,Coleophora alcyonipennella Koll.,2005,8/15/05,2005-08-16,1
799,LEPIDOPTERA,COLEOPHORIDAE,Coleophora alcyonipennella Koll.,2005,8/17/05,2005-08-18,1
800,LEPIDOPTERA,COLEOPHORIDAE,Coleophora alcyonipennella Koll.,2006,7/14/06,2006-07-20,1
801,LEPIDOPTERA,COLEOPHORIDAE,Coleophora alcyonipennella Koll.,2006,7/21/06,2006-07-27,6
802,LEPIDOPTERA,COLEOPHORIDAE,Coleophora alcyonipennella Koll.,2006,7/28/06,2006-08-03,1
803,LEPIDOPTERA,COLEOPHORIDAE,Coleophora alcyonipennella Koll.,2006,8/7/06,2006-08-10,1
804,LEPIDOPTERA,COLEOPHORIDAE,Coleophora alcyonipennella Koll.,2006,8/17/06,2006-08-24,1
805,LEPIDOPTERA,COLEOPHORIDAE,Coleophora alcyonipennella Koll.,2008,8/22/08,2008-08-24,1
806,LEPIDOPTERA,COLEOPHORIDAE,Coleophora alcyonipennella Koll.,2009,7/11/09,2009-07-20,1
807,LEPIDOPTERA,COLEOPHORIDAE,Coleophora alcyonipennella Koll.,2009,7/21/09,2009-07-27,2
808,LEPIDOPTERA,COLEOPHORIDAE,Coleophora alticolella Zell.,1993,6/1/93,1993-06-06,2
809,LEPIDOPTERA,COLEOPHORIDAE,Coleophora alticolella Zell.,1993,6/7/93,1993-06-10,2
810,LEPIDOPTERA,COLEOPHORIDAE,Coleophora alticolella Zell.,1995,6/26/95,1995-06-27,1
811,LEPIDOPTERA,COLEOPHORIDAE,Coleophora alticolella Zell.,2000,6/16/00,2000-06-21,1
812,LEPIDOPTERA,COLEOPHORIDAE,Coleophora alticolella Zell.,2003,7/21/03,2003-07-24,1
813,LEPIDOPTERA,COLEOPHORIDAE,Coleophora alticolella Zell.,2003,7/25/03,2003-07-31,1
814,LEPIDOPTERA,COLEOPHORIDAE,Coleophora alticolella Zell.,2004,7/15/04,2004-07-18,1
815,LEPIDOPTERA,COLEOPHORIDAE,Coleophora alticolella Zell.,2008,6/3/08,2008-06-08,1
816,LEPIDOPTERA,COLEOPHORIDAE,Coleophora anatipennella D. & S.,1992,6/24/92,1992-06-25,1
817,LEPIDOPTERA,COLEOPHORIDAE,Coleophora anatipennella D. & S.,1992,6/26/92,1992-06-28,1
818,LEPIDOPTERA,COLEOPHORIDAE,Coleophora anatipennella D. & S.,1993,7/1/93,1993-07-04,1
819,LEPIDOPTERA,COLEOPHORIDAE,Coleophora anatipennella D. & S.,1995,7/4/95,1995-07-06,1
820,LEPIDOPTERA,COLEOPHORIDAE,Coleophora anatipennella D. & S.,1995,7/10/95,1995-07-13,1
821,LEPIDOPTERA,COLEOPHORIDAE,Coleophora anatipennella D. & S.,1995,7/14/95,1995-07-17,1
822,LEPIDOPTERA,COLEOPHORIDAE,Coleophora anatipennella D. & S.,1995,7/18/95,1995-07-20,1
823,LEPIDOPTERA,COLEOPHORIDAE,Coleophora anatipennella D. & S.,1996,8/2/96,1996-08-08,1
824,LEPIDOPTERA,COLEOPHORIDAE,Coleophora anatipennella D. & S.,1998,7/13/98,1998-07-19,1
825,LEPIDOPTERA,COLEOPHORIDAE,Coleophora anatipennella D. & S.,1998,7/24/98,1998-07-26,1
826,LEPIDOPTERA,COLEOPHORIDAE,Coleophora anatipennella D. & S.,2000,6/16/00,2000-06-21,1
827,LEPIDOPTERA,COLEOPHORIDAE,Coleophora anatipennella D. & S.,2001,7/2/01,2001-07-03,1
828,LEPIDOPTERA,COLEOPHORIDAE,Coleophora anatipennella D. & S.,2002,7/4/02,2002-07-07,1
829,LEPIDOPTERA,COLEOPHORIDAE,Coleophora anatipennella D. & S.,2003,6/23/03,2003-07-10,1
830,LEPIDOPTERA,COLEOPHORIDAE,Coleophora anatipennella D. & S.,2003,7/21/03,2003-07-24,1
831,LEPIDOPTERA,COLEOPHORIDAE,Coleophora anatipennella D. & S.,2004,7/5/04,2004-07-14,3
832,LEPIDOPTERA,COLEOPHORIDAE,Coleophora anatipennella D. & S.,2004,7/15/04,2004-07-18,3
833,LEPIDOPTERA,COLEOPHORIDAE,Coleophora anatipennella D. & S.,2006,6/21/06,2006-06-25,1
834,LEPIDOPTERA,COLEOPHORIDAE,Coleophora anatipennella D. & S.,2007,6/11/07,2007-06-12,1
835,LEPIDOPTERA,COLEOPHORIDAE,Coleophora anatipennella D. & S.,2008,6/26/08,2008-07-02,1
836,LEPIDOPTERA,COLEOPHORIDAE,Coleophora anatipennella D. & S.,2009,6/26/09,2009-06-28,1
837,LEPIDOPTERA,COLEOPHORIDAE,Coleophora anatipennella D. & S.,2009,6/30/09,2009-07-02,1
838,LEPIDOPTERA,COLEOPHORIDAE,Coleophora argentula Stph.,1998,7/20/98,1998-07-21,1
839,LEPIDOPTERA,COLEOPHORIDAE,Coleophora artemisicolella Brd.,1992,7/10/92,1992-07-12,1
840,LEPIDOPTERA,COLEOPHORIDAE,Coleophora artemisicolella Brd.,1992,8/3/92,1992-08-05,1
841,LEPIDOPTERA,COLEOPHORIDAE,Coleophora artemisicolella Brd.,1992,8/10/92,1992-08-12,3
842,LEPIDOPTERA,COLEOPHORIDAE,Coleophora artemisicolella Brd.,1992,8/21/92,1992-08-23,1
843,LEPIDOPTERA,COLEOPHORIDAE,Coleophora asteris Mhl.,1997,8/14/97,1997-08-17,1
844,LEPIDOPTERA,COLEOPHORIDAE,Coleophora atriplicis Meyr.,1995,7/10/95,1995-07-13,1
845,LEPIDOPTERA,COLEOPHORIDAE,Coleophora atriplicis Meyr.,1999,6/30/99,1999-07-01,1
846,LEPIDOPTERA,COLEOPHORIDAE,Coleophora atriplicis Meyr.,1999,7/9/99,1999-07-11,2
847,LEPIDOPTERA,COLEOPHORIDAE,Coleophora atriplicis Meyr.,1999,7/12/99,1999-07-19,1
848,LEPIDOPTERA,COLEOPHORIDAE,Coleophora atriplicis Meyr.,2005,7/30/05,2005-08-02,1
849,LEPIDOPTERA,COLEOPHORIDAE,Coleophora atriplicis Meyr.,2006,7/14/06,2006-07-20,1
850,LEPIDOPTERA,COLEOPHORIDAE,Coleophora atriplicis Meyr.,2006,7/28/06,2006-08-03,1
851,LEPIDOPTERA,COLEOPHORIDAE,Coleophora atriplicis Meyr.,2006,8/7/06,2006-08-10,1
852,LEPIDOPTERA,COLEOPHORIDAE,Coleophora atriplicis Meyr.,2007,7/19/07,2007-07-25,1
853,LEPIDOPTERA,COLEOPHORIDAE,Coleophora badiipenella Dup.,1992,6/22/92,1992-06-23,1
854,LEPIDOPTERA,COLEOPHORIDAE,Coleophora badiipenella Dup.,1992,6/29/92,1992-07-02,2
855,LEPIDOPTERA,COLEOPHORIDAE,Coleophora badiipenella Dup.,1992,7/6/92,1992-07-08,1
856,LEPIDOPTERA,COLEOPHORIDAE,Coleophora badiipenella Dup.,1992,7/9/92,1992-07-09,1
857,LEPIDOPTERA,COLEOPHORIDAE,Coleophora badiipenella Dup.,1992,7/10/92,1992-07-12,2
858,LEPIDOPTERA,COLEOPHORIDAE,Coleophora badiipenella Dup.,1992,7/17/92,1992-07-20,1
859,LEPIDOPTERA,COLEOPHORIDAE,Coleophora badiipenella Dup.,1993,5/17/93,1993-05-23,1
860,LEPIDOPTERA,COLEOPHORIDAE,Coleophora badiipenella Dup.,1993,6/1/93,1993-06-06,6
861,LEPIDOPTERA,COLEOPHORIDAE,Coleophora badiipenella Dup.,1993,6/7/93,1993-06-10,1
862,LEPIDOPTERA,COLEOPHORIDAE,Coleophora badiipenella Dup.,1993,6/28/93,1993-06-30,2
863,LEPIDOPTERA,COLEOPHORIDAE,Coleophora badiipenella Dup.,1993,7/1/93,1993-07-04,3
864,LEPIDOPTERA,COLEOPHORIDAE,Coleophora badiipenella Dup.,1994,7/7/94,1994-07-11,1
865,LEPIDOPTERA,COLEOPHORIDAE,Coleophora badiipenella Dup.,1994,7/12/94,1994-07-14,1
866,LEPIDOPTERA,COLEOPHORIDAE,Coleophora badiipenella Dup.,1994,7/18/94,1994-07-19,1
867,LEPIDOPTERA,COLEOPHORIDAE,Coleophora badiipenella Dup.,1994,7/20/94,1994-07-21,1
868,LEPIDOPTERA,COLEOPHORIDAE,Coleophora badiipenella Dup.,1994,7/22/94,1994-07-24,1
869,LEPIDOPTERA,COLEOPHORIDAE,Coleophora badiipenella Dup.,1995,6/26/95,1995-06-27,1
870,LEPIDOPTERA,COLEOPHORIDAE,Coleophora badiipenella Dup.,1995,7/4/95,1995-07-06,1
871,LEPIDOPTERA,COLEOPHORIDAE,Coleophora badiipenella Dup.,1995,7/7/95,1995-07-09,1
872,LEPIDOPTERA,COLEOPHORIDAE,Coleophora badiipenella Dup.,1995,7/10/95,1995-07-13,1
873,LEPIDOPTERA,COLEOPHORIDAE,Coleophora badiipenella Dup.,1995,7/18/95,1995-07-20,2
874,LEPIDOPTERA,COLEOPHORIDAE,Coleophora badiipenella Dup.,1995,7/30/95,1995-07-30,1
875,LEPIDOPTERA,COLEOPHORIDAE,Coleophora badiipenella Dup.,1996,6/21/96,1996-06-25,1
876,LEPIDOPTERA,COLEOPHORIDAE,Coleophora badiipenella Dup.,1996,6/26/96,1996-06-30,1
877,LEPIDOPTERA,COLEOPHORIDAE,Coleophora badiipenella Dup.,1996,7/18/96,1996-07-23,2
878,LEPIDOPTERA,COLEOPHORIDAE,Coleophora badiipenella Dup.,1996,7/24/96,1996-07-25,2
879,LEPIDOPTERA,COLEOPHORIDAE,Coleophora badiipenella Dup.,2004,8/2/04,2004-08-03,1
880,LEPIDOPTERA,COLEOPHORIDAE,Coleophora badiipenella Dup.,2006,6/21/06,2006-06-25,1
881,LEPIDOPTERA,COLEOPHORIDAE,Coleophora badiipenella Dup.,2006,7/3/06,2006-07-06,1
882,LEPIDOPTERA,COLEOPHORIDAE,Coleophora badiipenella Dup.,2006,7/7/06,2006-07-09,1
883,LEPIDOPTERA,COLEOPHORIDAE,Coleophora badiipenella Dup.,2008,7/3/08,2008-07-08,1
884,LEPIDOPTERA,COLEOPHORIDAE,Coleophora badiipenella Dup.,2008,7/9/08,2008-07-10,1
885,LEPIDOPTERA,COLEOPHORIDAE,Coleophora badiipenella Dup.,2009,6/26/09,2009-06-28,1
886,LEPIDOPTERA,COLEOPHORIDAE,Coleophora binderella Koll.,1994,7/18/94,1994-07-19,1
887,LEPIDOPTERA,COLEOPHORIDAE,Coleophora binderella Koll.,1997,7/21/97,1997-07-21,2
888,LEPIDOPTERA,COLEOPHORIDAE,Coleophora caespititiella Zell.,1993,6/1/93,1993-06-06,4
889,LEPIDOPTERA,COLEOPHORIDAE,Coleophora caespititiella Zell.,1995,6/12/95,1995-06-19,1
890,LEPIDOPTERA,COLEOPHORIDAE,Coleophora caespititiella Zell.,1996,6/21/96,1996-06-25,1
891,LEPIDOPTERA,COLEOPHORIDAE,Coleophora caespititiella Zell.,1999,6/14/99,1999-06-16,1
892,LEPIDOPTERA,COLEOPHORIDAE,Coleophora caespititiella Zell.,2000,6/9/00,2000-06-12,1
893,LEPIDOPTERA,COLEOPHORIDAE,Coleophora caespititiella Zell.,2004,6/8/04,2004-06-10,1
894,LEPIDOPTERA,COLEOPHORIDAE,Coleophora caespititiella Zell.,2007,5/22/07,2007-05-30,1
895,LEPIDOPTERA,COLEOPHORIDAE,Coleophora caespititiella Zell.,2007,5/31/07,2007-06-06,1
896,LEPIDOPTERA,COLEOPHORIDAE,Coleophora caespititiella Zell.,2007,6/11/07,2007-06-12,1
897,LEPIDOPTERA,COLEOPHORIDAE,Coleophora caespititiella Zell.,2007,6/18/07,2007-06-21,1
898,LEPIDOPTERA,COLEOPHORIDAE,Coleophora caespititiella Zell.,2008,6/3/08,2008-06-08,1
899,LEPIDOPTERA,COLEOPHORIDAE,Coleophora clypeiferella O. Hofm.,2004,7/22/04,2004-07-25,1
900,LEPIDOPTERA,COLEOPHORIDAE,Coleophora clypeiferella O. Hofm.,2009,7/11/09,2009-07-20,1
901,LEPIDOPTERA,COLEOPHORIDAE,Coleophora currucipennella Zell.,1995,6/20/95,1995-06-25,1
902,LEPIDOPTERA,COLEOPHORIDAE,Coleophora deauratella Lien. & Zell,1992,7/10/92,1992-07-12,1
903,LEPIDOPTERA,COLEOPHORIDAE,Coleophora deauratella Lien. & Zell,1992,8/3/92,1992-08-05,1
904,LEPIDOPTERA,COLEOPHORIDAE,Coleophora deauratella Lien. & Zell,1993,6/28/93,1993-06-30,1
905,LEPIDOPTERA,COLEOPHORIDAE,Coleophora deauratella Lien. & Zell,1993,7/1/93,1993-07-04,1
906,LEPIDOPTERA,COLEOPHORIDAE,Coleophora deauratella Lien. & Zell,1995,7/7/95,1995-07-09,3
907,LEPIDOPTERA,COLEOPHORIDAE,Coleophora deauratella Lien. & Zell,1995,7/10/95,1995-07-13,6
908,LEPIDOPTERA,COLEOPHORIDAE,Coleophora deauratella Lien. & Zell,1995,7/14/95,1995-07-17,3
909,LEPIDOPTERA,COLEOPHORIDAE,Coleophora deauratella Lien. & Zell,1995,8/1/95,1995-08-01,1
910,LEPIDOPTERA,COLEOPHORIDAE,Coleophora deauratella Lien. & Zell,1996,7/5/96,1996-07-11,1
911,LEPIDOPTERA,COLEOPHORIDAE,Coleophora deauratella Lien. & Zell,1996,7/30/96,1996-08-01,1
912,LEPIDOPTERA,COLEOPHORIDAE,Coleophora deauratella Lien. & Zell,1996,8/14/96,1996-08-15,1
913,LEPIDOPTERA,COLEOPHORIDAE,Coleophora deauratella Lien. & Zell,1997,7/11/97,1997-07-13,1
914,LEPIDOPTERA,COLEOPHORIDAE,Coleophora deauratella Lien. & Zell,1998,7/9/98,1998-07-12,1
915,LEPIDOPTERA,COLEOPHORIDAE,Coleophora deauratella Lien. & Zell,2000,7/25/00,2000-07-27,2
916,LEPIDOPTERA,COLEOPHORIDAE,Coleophora deauratella Lien. & Zell,2001,7/4/01,2001-07-08,1
917,LEPIDOPTERA,COLEOPHORIDAE,Coleophora deauratella Lien. & Zell,2001,7/20/01,2001-07-23,1
918,LEPIDOPTERA,COLEOPHORIDAE,Coleophora deauratella Lien. & Zell,2006,7/3/06,2006-07-06,1
919,LEPIDOPTERA,COLEOPHORIDAE,Coleophora deauratella Lien. & Zell,2006,7/10/06,2006-07-13,1
920,LEPIDOPTERA,COLEOPHORIDAE,Coleophora deauratella Lien. & Zell,2008,7/3/08,2008-07-08,1
921,LEPIDOPTERA,COLEOPHORIDAE,Coleophora flavipennella Dup.,1992,6/26/92,1992-06-28,1
922,LEPIDOPTERA,COLEOPHORIDAE,Coleophora flavipennella Dup.,1995,7/25/95,1995-07-27,1
923,LEPIDOPTERA,COLEOPHORIDAE,Coleophora flavipennella Dup.,1998,8/7/98,1998-08-11,1
924,LEPIDOPTERA,COLEOPHORIDAE,Coleophora flavipennella Dup.,2005,7/15/05,2005-07-17,1
925,LEPIDOPTERA,COLEOPHORIDAE,Coleophora gallipennella Hb.,1995,6/26/95,1995-06-27,1
926,LEPIDOPTERA,COLEOPHORIDAE,Coleophora glaucicolella Wood,1992,8/10/92,1992-08-12,1
927,LEPIDOPTERA,COLEOPHORIDAE,Coleophora glaucicolella Wood,1996,7/5/96,1996-07-11,1
928,LEPIDOPTERA,COLEOPHORIDAE,Coleophora glaucicolella Wood,1996,7/12/96,1996-07-17,1
929,LEPIDOPTERA,COLEOPHORIDAE,Coleophora glaucicolella Wood,1996,7/18/96,1996-07-23,3
930,LEPIDOPTERA,COLEOPHORIDAE,Coleophora glaucicolella Wood,1996,7/26/96,1996-07-29,1
931,LEPIDOPTERA,COLEOPHORIDAE,Coleophora glaucicolella Wood,1997,7/4/97,1997-07-06,1
932,LEPIDOPTERA,COLEOPHORIDAE,Coleophora glaucicolella Wood,1997,7/11/97,1997-07-13,1
933,LEPIDOPTERA,COLEOPHORIDAE,Coleophora glaucicolella Wood,2003,7/11/03,2003-07-14,1
934,LEPIDOPTERA,COLEOPHORIDAE,Coleophora glaucicolella Wood,2003,7/15/03,2003-07-20,2
935,LEPIDOPTERA,COLEOPHORIDAE,Coleophora glaucicolella Wood,2004,7/22/04,2004-07-25,1
936,LEPIDOPTERA,COLEOPHORIDAE,Coleophora glaucicolella Wood,2004,8/2/04,2004-08-03,1
937,LEPIDOPTERA,COLEOPHORIDAE,Coleophora glaucicolella Wood,2007,6/7/07,2007-06-10,1
938,LEPIDOPTERA,COLEOPHORIDAE,Coleophora glaucicolella Wood,2007,6/29/07,2007-07-08,1
939,LEPIDOPTERA,COLEOPHORIDAE,Coleophora glaucicolella Wood,2008,7/3/08,2008-07-08,1
940,LEPIDOPTERA,COLEOPHORIDAE,Coleophora ibipennella Zell.,1992,6/24/92,1992-06-25,2
941,LEPIDOPTERA,COLEOPHORIDAE,Coleophora ibipennella Zell.,1992,6/26/92,1992-06-28,3
942,LEPIDOPTERA,COLEOPHORIDAE,Coleophora ibipennella Zell.,1992,6/29/92,1992-07-02,2
943,LEPIDOPTERA,COLEOPHORIDAE,Coleophora ibipennella Zell.,1994,7/7/94,1994-07-11,1
944,LEPIDOPTERA,COLEOPHORIDAE,Coleophora ibipennella Zell.,1994,7/12/94,1994-07-14,1
945,LEPIDOPTERA,COLEOPHORIDAE,Coleophora ibipennella Zell.,1994,7/20/94,1994-07-21,1
946,LEPIDOPTERA,COLEOPHORIDAE,Coleophora ibipennella Zell.,1995,7/7/95,1995-07-09,1
947,LEPIDOPTERA,COLEOPHORIDAE,Coleophora ibipennella Zell.,1995,7/10/95,1995-07-13,3
948,LEPIDOPTERA,COLEOPHORIDAE,Coleophora ibipennella Zell.,1995,7/14/95,1995-07-17,4
949,LEPIDOPTERA,COLEOPHORIDAE,Coleophora ibipennella Zell.,1995,7/18/95,1995-07-20,4
950,LEPIDOPTERA,COLEOPHORIDAE,Coleophora ibipennella Zell.,1996,7/18/96,1996-07-23,1
951,LEPIDOPTERA,COLEOPHORIDAE,Coleophora ibipennella Zell.,1996,7/24/96,1996-07-25,5
952,LEPIDOPTERA,COLEOPHORIDAE,Coleophora ibipennella Zell.,1996,8/2/96,1996-08-08,1
953,LEPIDOPTERA,COLEOPHORIDAE,Coleophora ibipennella Zell.,1997,7/9/97,1997-07-10,5
954,LEPIDOPTERA,COLEOPHORIDAE,Coleophora ibipennella Zell.,1997,7/11/97,1997-07-13,3
955,LEPIDOPTERA,COLEOPHORIDAE,Coleophora ibipennella Zell.,1998,7/3/98,1998-07-08,1
956,LEPIDOPTERA,COLEOPHORIDAE,Coleophora ibipennella Zell.,1998,7/13/98,1998-07-19,1
957,LEPIDOPTERA,COLEOPHORIDAE,Coleophora ibipennella Zell.,1998,7/20/98,1998-07-21,6
958,LEPIDOPTERA,COLEOPHORIDAE,Coleophora ibipennella Zell.,1998,7/22/98,1998-07-23,6
959,LEPIDOPTERA,COLEOPHORIDAE,Coleophora ibipennella Zell.,1999,7/5/99,1999-07-06,1
960,LEPIDOPTERA,COLEOPHORIDAE,Coleophora ibipennella Zell.,1999,7/7/99,1999-07-08,3
961,LEPIDOPTERA,COLEOPHORIDAE,Coleophora ibipennella Zell.,1999,7/9/99,1999-07-11,7
962,LEPIDOPTERA,COLEOPHORIDAE,Coleophora ibipennella Zell.,1999,7/12/99,1999-07-19,1
963,LEPIDOPTERA,COLEOPHORIDAE,Coleophora ibipennella Zell.,2000,7/3/00,2000-07-06,2
964,LEPIDOPTERA,COLEOPHORIDAE,Coleophora ibipennella Zell.,2000,7/12/00,2000-07-18,3
965,LEPIDOPTERA,COLEOPHORIDAE,Coleophora ibipennella Zell.,2000,7/21/00,2000-07-24,2
966,LEPIDOPTERA,COLEOPHORIDAE,Coleophora ibipennella Zell.,2001,7/4/01,2001-07-08,8
967,LEPIDOPTERA,COLEOPHORIDAE,Coleophora ibipennella Zell.,2001,7/9/01,2001-07-12,2
968,LEPIDOPTERA,COLEOPHORIDAE,Coleophora ibipennella Zell.,2001,7/13/01,2001-07-16,1
969,LEPIDOPTERA,COLEOPHORIDAE,Coleophora ibipennella Zell.,2001,7/20/01,2001-07-23,1
970,LEPIDOPTERA,COLEOPHORIDAE,Coleophora ibipennella Zell.,2002,7/4/02,2002-07-07,1
971,LEPIDOPTERA,COLEOPHORIDAE,Coleophora ibipennella Zell.,2002,7/8/02,2002-07-11,1
972,LEPIDOPTERA,COLEOPHORIDAE,Coleophora ibipennella Zell.,2002,7/12/02,2002-07-15,3
973,LEPIDOPTERA,COLEOPHORIDAE,Coleophora ibipennella Zell.,2002,7/16/02,2002-07-17,5
974,LEPIDOPTERA,COLEOPHORIDAE,Coleophora ibipennella Zell.,2002,7/18/02,2002-07-28,1
975,LEPIDOPTERA,COLEOPHORIDAE,Coleophora ibipennella Zell.,2003,6/23/03,2003-07-10,37
976,LEPIDOPTERA,COLEOPHORIDAE,Coleophora ibipennella Zell.,2003,7/11/03,2003-07-14,44
977,LEPIDOPTERA,COLEOPHORIDAE,Coleophora ibipennella Zell.,2003,7/15/03,2003-07-20,8
978,LEPIDOPTERA,COLEOPHORIDAE,Coleophora ibipennella Zell.,2004,7/15/04,2004-07-18,8
979,LEPIDOPTERA,COLEOPHORIDAE,Coleophora ibipennella Zell.,2004,7/22/04,2004-07-25,8
980,LEPIDOPTERA,COLEOPHORIDAE,Coleophora ibipennella Zell.,2004,7/26/04,2004-07-27,2
981,LEPIDOPTERA,COLEOPHORIDAE,Coleophora ibipennella Zell.,2004,7/28/04,2004-07-29,14
982,LEPIDOPTERA,COLEOPHORIDAE,Coleophora ibipennella Zell.,2004,7/30/04,2004-08-01,9
983,LEPIDOPTERA,COLEOPHORIDAE,Coleophora ibipennella Zell.,2004,8/2/04,2004-08-03,1
984,LEPIDOPTERA,COLEOPHORIDAE,Coleophora ibipennella Zell.,2005,7/7/05,2005-07-07,5
985,LEPIDOPTERA,COLEOPHORIDAE,Coleophora ibipennella Zell.,2005,7/8/05,2005-07-10,3
986,LEPIDOPTERA,COLEOPHORIDAE,Coleophora ibipennella Zell.,2005,7/11/05,2005-07-11,3
987,LEPIDOPTERA,COLEOPHORIDAE,Coleophora ibipennella Zell.,2005,7/12/05,2005-07-14,13
988,LEPIDOPTERA,COLEOPHORIDAE,Coleophora ibipennella Zell.,2005,7/15/05,2005-07-17,2
989,LEPIDOPTERA,COLEOPHORIDAE,Coleophora ibipennella Zell.,2005,7/20/05,2005-07-21,1
990,LEPIDOPTERA,COLEOPHORIDAE,Coleophora ibipennella Zell.,2006,6/29/06,2006-07-02,1
991,LEPIDOPTERA,COLEOPHORIDAE,Coleophora ibipennella Zell.,2006,7/3/06,2006-07-06,5
992,LEPIDOPTERA,COLEOPHORIDAE,Coleophora ibipennella Zell.,2006,7/7/06,2006-07-09,7
993,LEPIDOPTERA,COLEOPHORIDAE,Coleophora ibipennella Zell.,2006,7/10/06,2006-07-13,3
994,LEPIDOPTERA,COLEOPHORIDAE,Coleophora ibipennella Zell.,2006,7/14/06,2006-07-20,1
995,LEPIDOPTERA,COLEOPHORIDAE,Coleophora ibipennella Zell.,2007,7/9/07,2007-07-18,5
996,LEPIDOPTERA,COLEOPHORIDAE,Coleophora ibipennella Zell.,2008,7/3/08,2008-07-08,5
997,LEPIDOPTERA,COLEOPHORIDAE,Coleophora ibipennella Zell.,2008,7/11/08,2008-07-23,2
998,LEPIDOPTERA,COLEOPHORIDAE,Coleophora ibipennella Zell.,2009,6/30/09,2009-07-02,3
999,LEPIDOPTERA,COLEOPHORIDAE,Coleophora ibipennella Zell.,2009,7/3/09,2009-07-10,9
1000,LEPIDOPTERA,COLEOPHORIDAE,Coleophora ibipennella Zell.,2009,7/11/09,2009-07-20,3
1001,LEPIDOPTERA,COLEOPHORIDAE,Coleophora kuehnella Goeze,1998,7/3/98,1998-07-08,1
1002,LEPIDOPTERA,COLEOPHORIDAE,Coleophora kuehnella Goeze,1999,7/9/99,1999-07-11,1
1003,LEPIDOPTERA,COLEOPHORIDAE,Coleophora kuehnella Goeze,2001,7/4/01,2001-07-08,1
1004,LEPIDOPTERA,COLEOPHORIDAE,Coleophora kuehnella Goeze,2004,7/1/04,2004-07-04,1
1005,LEPIDOPTERA,COLEOPHORIDAE,Coleophora kuehnella Goeze,2004,7/22/04,2004-07-25,1
1006,LEPIDOPTERA,COLEOPHORIDAE,Coleophora kuehnella Goeze,2006,6/26/06,2006-06-28,1
1007,LEPIDOPTERA,COLEOPHORIDAE,Coleophora laricella Hb.,1993,5/24/93,1993-05-31,2
1008,LEPIDOPTERA,COLEOPHORIDAE,Coleophora laricella Hb.,1993,6/1/93,1993-06-06,85
1009,LEPIDOPTERA,COLEOPHORIDAE,Coleophora laricella Hb.,1993,6/7/93,1993-06-10,5
1010,LEPIDOPTERA,COLEOPHORIDAE,Coleophora laricella Hb.,1993,6/11/93,1993-06-14,1
1011,LEPIDOPTERA,COLEOPHORIDAE,Coleophora laricella Hb.,1994,6/8/94,1994-06-13,1
1012,LEPIDOPTERA,COLEOPHORIDAE,Coleophora laricella Hb.,1994,6/14/94,1994-06-23,1
1013,LEPIDOPTERA,COLEOPHORIDAE,Coleophora laricella Hb.,1994,6/24/94,1994-06-28,15
1014,LEPIDOPTERA,COLEOPHORIDAE,Coleophora laricella Hb.,1995,6/12/95,1995-06-19,3
1015,LEPIDOPTERA,COLEOPHORIDAE,Coleophora laricella Hb.,1995,6/20/95,1995-06-25,48
1016,LEPIDOPTERA,COLEOPHORIDAE,Coleophora laricella Hb.,1995,6/26/95,1995-06-27,72
1017,LEPIDOPTERA,COLEOPHORIDAE,Coleophora laricella Hb.,1995,6/28/95,1995-06-29,7
1018,LEPIDOPTERA,COLEOPHORIDAE,Coleophora laricella Hb.,1995,6/30/95,1995-07-03,3
1019,LEPIDOPTERA,COLEOPHORIDAE,Coleophora laricella Hb.,1995,7/4/95,1995-07-06,1
1020,LEPIDOPTERA,COLEOPHORIDAE,Coleophora laricella Hb.,1995,7/7/95,1995-07-09,1
1021,LEPIDOPTERA,COLEOPHORIDAE,Coleophora laricella Hb.,1996,6/13/96,1996-06-20,11
1022,LEPIDOPTERA,COLEOPHORIDAE,Coleophora laricella Hb.,1996,6/26/96,1996-06-30,23
1023,LEPIDOPTERA,COLEOPHORIDAE,Coleophora laricella Hb.,1996,7/5/96,1996-07-11,1
1024,LEPIDOPTERA,COLEOPHORIDAE,Coleophora laricella Hb.,1996,7/12/96,1996-07-17,1
1025,LEPIDOPTERA,COLEOPHORIDAE,Coleophora laricella Hb.,1997,6/9/97,1997-06-12,3
1026,LEPIDOPTERA,COLEOPHORIDAE,Coleophora laricella Hb.,1997,6/13/97,1997-06-22,5
1027,LEPIDOPTERA,COLEOPHORIDAE,Coleophora laricella Hb.,1997,6/23/97,1997-06-23,1
1028,LEPIDOPTERA,COLEOPHORIDAE,Coleophora laricella Hb.,1998,6/2/98,1998-06-07,2
1029,LEPIDOPTERA,COLEOPHORIDAE,Coleophora laricella Hb.,1998,6/8/98,1998-06-11,19
1030,LEPIDOPTERA,COLEOPHORIDAE,Coleophora laricella Hb.,1998,6/12/98,1998-06-14,1
1031,LEPIDOPTERA,COLEOPHORIDAE,Coleophora laricella Hb.,1998,6/19/98,1998-06-21,3
1032,LEPIDOPTERA,COLEOPHORIDAE,Coleophora laricella Hb.,1998,6/26/98,1998-06-29,1
1033,LEPIDOPTERA,COLEOPHORIDAE,Coleophora laricella Hb.,1999,6/14/99,1999-06-16,9
1034,LEPIDOPTERA,COLEOPHORIDAE,Coleophora laricella Hb.,1999,6/28/99,1999-06-29,2
1035,LEPIDOPTERA,COLEOPHORIDAE,Coleophora laricella Hb.,1999,6/30/99,1999-07-01,1
1036,LEPIDOPTERA,COLEOPHORIDAE,Coleophora laricella Hb.,1999,7/2/99,1999-07-04,3
1037,LEPIDOPTERA,COLEOPHORIDAE,Coleophora laricella Hb.,1999,7/9/99,1999-07-11,1
1038,LEPIDOPTERA,COLEOPHORIDAE,Coleophora laricella Hb.,2000,5/17/00,2000-06-08,12
1039,LEPIDOPTERA,COLEOPHORIDAE,Coleophora laricella Hb.,2000,6/9/00,2000-06-12,15
1040,LEPIDOPTERA,COLEOPHORIDAE,Coleophora laricella Hb.,2000,6/13/00,2000-06-15,3
1041,LEPIDOPTERA,COLEOPHORIDAE,Coleophora laricella Hb.,2000,6/16/00,2000-06-21,18
1042,LEPIDOPTERA,COLEOPHORIDAE,Coleophora laricella Hb.,2001,6/15/01,2001-06-19,11
1043,LEPIDOPTERA,COLEOPHORIDAE,Coleophora laricella Hb.,2001,6/20/01,2001-06-24,34
1044,LEPIDOPTERA,COLEOPHORIDAE,Coleophora laricella Hb.,2001,6/25/01,2001-06-27,18
1045,LEPIDOPTERA,COLEOPHORIDAE,Coleophora laricella Hb.,2001,6/28/01,2001-07-01,5
1046,LEPIDOPTERA,COLEOPHORIDAE,Coleophora laricella Hb.,2001,7/4/01,2001-07-08,1
1047,LEPIDOPTERA,COLEOPHORIDAE,Coleophora laricella Hb.,2002,5/29/02,2002-05-31,1
1048,LEPIDOPTERA,COLEOPHORIDAE,Coleophora laricella Hb.,2002,6/1/02,2002-06-10,24
1049,LEPIDOPTERA,COLEOPHORIDAE,Coleophora laricella Hb.,2002,6/11/02,2002-06-16,4
1050,LEPIDOPTERA,COLEOPHORIDAE,Coleophora laricella Hb.,2002,6/17/02,2002-06-18,6
1051,LEPIDOPTERA,COLEOPHORIDAE,Coleophora laricella Hb.,2003,6/2/03,2003-06-09,30
1052,LEPIDOPTERA,COLEOPHORIDAE,Coleophora laricella Hb.,2003,6/10/03,2003-06-15,45
1053,LEPIDOPTERA,COLEOPHORIDAE,Coleophora laricella Hb.,2003,6/16/03,2003-06-22,2
1054,LEPIDOPTERA,COLEOPHORIDAE,Coleophora laricella Hb.,2003,6/23/03,2003-07-10,1
1055,LEPIDOPTERA,COLEOPHORIDAE,Coleophora laricella Hb.,2003,7/15/03,2003-07-20,3
1056,LEPIDOPTERA,COLEOPHORIDAE,Coleophora laricella Hb.,2004,6/8/04,2004-06-10,33
1057,LEPIDOPTERA,COLEOPHORIDAE,Coleophora laricella Hb.,2004,6/11/04,2004-06-14,6
1058,LEPIDOPTERA,COLEOPHORIDAE,Coleophora laricella Hb.,2004,6/15/04,2004-06-23,2
1059,LEPIDOPTERA,COLEOPHORIDAE,Coleophora laricella Hb.,2004,6/28/04,2004-06-30,1
1060,LEPIDOPTERA,COLEOPHORIDAE,Coleophora laricella Hb.,2005,6/9/05,2005-06-14,2
1061,LEPIDOPTERA,COLEOPHORIDAE,Coleophora laricella Hb.,2005,6/16/05,2005-06-17,19
1062,LEPIDOPTERA,COLEOPHORIDAE,Coleophora laricella Hb.,2005,6/18/05,2005-06-21,22
1063,LEPIDOPTERA,COLEOPHORIDAE,Coleophora laricella Hb.,2005,6/22/05,2005-06-26,37
1064,LEPIDOPTERA,COLEOPHORIDAE,Coleophora laricella Hb.,2005,6/27/05,2005-06-30,2
1065,LEPIDOPTERA,COLEOPHORIDAE,Coleophora laricella Hb.,2005,7/1/05,2005-07-03,1
1066,LEPIDOPTERA,COLEOPHORIDAE,Coleophora laricella Hb.,2006,6/14/06,2006-06-20,88
1067,LEPIDOPTERA,COLEOPHORIDAE,Coleophora laricella Hb.,2006,6/21/06,2006-06-25,8
1068,LEPIDOPTERA,COLEOPHORIDAE,Coleophora laricella Hb.,2007,5/22/07,2007-05-30,9
1069,LEPIDOPTERA,COLEOPHORIDAE,Coleophora laricella Hb.,2007,5/31/07,2007-06-06,12
1070,LEPIDOPTERA,COLEOPHORIDAE,Coleophora laricella Hb.,2007,6/7/07,2007-06-10,20
1071,LEPIDOPTERA,COLEOPHORIDAE,Coleophora laricella Hb.,2007,6/11/07,2007-06-12,4
1072,LEPIDOPTERA,COLEOPHORIDAE,Coleophora laricella Hb.,2008,6/3/08,2008-06-08,38
1073,LEPIDOPTERA,COLEOPHORIDAE,Coleophora laricella Hb.,2008,6/9/08,2008-06-16,4
1074,LEPIDOPTERA,COLEOPHORIDAE,Coleophora laricella Hb.,2009,5/20/09,2009-06-02,14
1075,LEPIDOPTERA,COLEOPHORIDAE,Coleophora lineolea Hw.,1995,7/22/95,1995-07-24,1
1076,LEPIDOPTERA,COLEOPHORIDAE,Coleophora lutipennella Zell.,1992,7/3/92,1992-07-05,1
1077,LEPIDOPTERA,COLEOPHORIDAE,Coleophora lutipennella Zell.,1992,7/10/92,1992-07-12,1
1078,LEPIDOPTERA,COLEOPHORIDAE,Coleophora lutipennella Zell.,1992,7/13/92,1992-07-16,2
1079,LEPIDOPTERA,COLEOPHORIDAE,Coleophora lutipennella Zell.,1995,7/14/95,1995-07-17,1
1080,LEPIDOPTERA,COLEOPHORIDAE,Coleophora lutipennella Zell.,1998,6/26/98,1998-06-29,1
1081,LEPIDOPTERA,COLEOPHORIDAE,Coleophora lutipennella Zell.,1998,7/3/98,1998-07-08,1
1082,LEPIDOPTERA,COLEOPHORIDAE,Coleophora lutipennella Zell.,1998,7/13/98,1998-07-19,1
1083,LEPIDOPTERA,COLEOPHORIDAE,Coleophora lutipennella Zell.,1998,7/24/98,1998-07-26,1
1084,LEPIDOPTERA,COLEOPHORIDAE,Coleophora lutipennella Zell.,2005,7/4/05,2005-07-06,1
1085,LEPIDOPTERA,COLEOPHORIDAE,Coleophora lutipennella Zell.,2005,7/11/05,2005-07-11,6
1086,LEPIDOPTERA,COLEOPHORIDAE,Coleophora lutipennella Zell.,2005,7/12/05,2005-07-14,1
1087,LEPIDOPTERA,COLEOPHORIDAE,Coleophora lutipennella Zell.,2005,7/15/05,2005-07-17,31
1088,LEPIDOPTERA,COLEOPHORIDAE,Coleophora lutipennella Zell.,2005,7/18/05,2005-07-19,9
1089,LEPIDOPTERA,COLEOPHORIDAE,Coleophora lutipennella Zell.,2005,7/20/05,2005-07-21,12
1090,LEPIDOPTERA,COLEOPHORIDAE,Coleophora lutipennella Zell.,2005,7/22/05,2005-07-26,41
1091,LEPIDOPTERA,COLEOPHORIDAE,Coleophora lutipennella Zell.,2005,7/27/05,2005-07-29,26
1092,LEPIDOPTERA,COLEOPHORIDAE,Coleophora lutipennella Zell.,2005,7/30/05,2005-08-02,20
1093,LEPIDOPTERA,COLEOPHORIDAE,Coleophora lutipennella Zell.,2005,8/3/05,2005-08-05,8
1094,LEPIDOPTERA,COLEOPHORIDAE,Coleophora lutipennella Zell.,2005,8/6/05,2005-08-14,4
1095,LEPIDOPTERA,COLEOPHORIDAE,Coleophora lutipennella Zell.,2005,8/17/05,2005-08-18,1
1096,LEPIDOPTERA,COLEOPHORIDAE,Coleophora lutipennella Zell.,2006,7/3/06,2006-07-06,3
1097,LEPIDOPTERA,COLEOPHORIDAE,Coleophora lutipennella Zell.,2008,6/23/08,2008-06-25,2
1098,LEPIDOPTERA,COLEOPHORIDAE,Coleophora lutipennella Zell.,1992,6/22/92,1992-06-23,4
1099,LEPIDOPTERA,COLEOPHORIDAE,Coleophora lutipennella Zell.,1992,6/24/92,1992-06-25,3
1100,LEPIDOPTERA,COLEOPHORIDAE,Coleophora lutipennella Zell.,1992,6/26/92,1992-06-28,2
1101,LEPIDOPTERA,COLEOPHORIDAE,Coleophora lutipennella Zell.,1992,6/29/92,1992-07-02,7
1102,LEPIDOPTERA,COLEOPHORIDAE,Coleophora lutipennella Zell.,1992,7/6/92,1992-07-08,3
1103,LEPIDOPTERA,COLEOPHORIDAE,Coleophora lutipennella Zell.,1992,7/10/92,1992-07-12,7
1104,LEPIDOPTERA,COLEOPHORIDAE,Coleophora lutipennella Zell.,1992,7/13/92,1992-07-16,9
1105,LEPIDOPTERA,COLEOPHORIDAE,Coleophora lutipennella Zell.,1992,7/17/92,1992-07-20,15
1106,LEPIDOPTERA,COLEOPHORIDAE,Coleophora lutipennella Zell.,1992,7/21/92,1992-07-23,12
1107,LEPIDOPTERA,COLEOPHORIDAE,Coleophora lutipennella Zell.,1992,7/24/92,1992-07-28,3
1108,LEPIDOPTERA,COLEOPHORIDAE,Coleophora lutipennella Zell.,1992,7/29/92,1992-08-02,2
1109,LEPIDOPTERA,COLEOPHORIDAE,Coleophora lutipennella Zell.,1992,8/3/92,1992-08-05,1
1110,LEPIDOPTERA,COLEOPHORIDAE,Coleophora lutipennella Zell.,1993,6/28/93,1993-06-30,4
1111,LEPIDOPTERA,COLEOPHORIDAE,Coleophora lutipennella Zell.,1993,7/1/93,1993-07-04,12
1112,LEPIDOPTERA,COLEOPHORIDAE,Coleophora lutipennella Zell.,1993,7/5/93,1993-07-07,1
1113,LEPIDOPTERA,COLEOPHORIDAE,Coleophora lutipennella Zell.,1993,7/8/93,1993-07-11,4
1114,LEPIDOPTERA,COLEOPHORIDAE,Coleophora lutipennella Zell.,1993,7/12/93,1993-07-14,1
1115,LEPIDOPTERA,COLEOPHORIDAE,Coleophora lutipennella Zell.,1994,7/4/94,1994-07-06,1
1116,LEPIDOPTERA,COLEOPHORIDAE,Coleophora lutipennella Zell.,1994,7/7/94,1994-07-11,6
1117,LEPIDOPTERA,COLEOPHORIDAE,Coleophora lutipennella Zell.,1994,7/12/94,1994-07-14,7
1118,LEPIDOPTERA,COLEOPHORIDAE,Coleophora lutipennella Zell.,1994,7/15/94,1994-07-17,15
1119,LEPIDOPTERA,COLEOPHORIDAE,Coleophora lutipennella Zell.,1994,7/18/94,1994-07-19,7
1120,LEPIDOPTERA,COLEOPHORIDAE,Coleophora lutipennella Zell.,1994,7/20/94,1994-07-21,9
1121,LEPIDOPTERA,COLEOPHORIDAE,Coleophora lutipennella Zell.,1994,7/22/94,1994-07-24,2
1122,LEPIDOPTERA,COLEOPHORIDAE,Coleophora lutipennella Zell.,1994,7/25/94,1994-07-26,3
1123,LEPIDOPTERA,COLEOPHORIDAE,Coleophora lutipennella Zell.,1994,7/27/94,1994-07-27,1
1124,LEPIDOPTERA,COLEOPHORIDAE,Coleophora lutipennella Zell.,1994,7/29/94,1994-07-31,1
1125,LEPIDOPTERA,COLEOPHORIDAE,Coleophora lutipennella Zell.,1994,8/2/94,1994-08-04,1
1126,LEPIDOPTERA,COLEOPHORIDAE,Coleophora lutipennella Zell.,1995,7/7/95,1995-07-09,8
1127,LEPIDOPTERA,COLEOPHORIDAE,Coleophora lutipennella Zell.,1995,7/10/95,1995-07-13,10
1128,LEPIDOPTERA,COLEOPHORIDAE,Coleophora lutipennella Zell.,1995,7/14/95,1995-07-17,44
1129,LEPIDOPTERA,COLEOPHORIDAE,Coleophora lutipennella Zell.,1995,7/18/95,1995-07-20,41
1130,LEPIDOPTERA,COLEOPHORIDAE,Coleophora lutipennella Zell.,1995,7/21/95,1995-07-21,32
1131,LEPIDOPTERA,COLEOPHORIDAE,Coleophora lutipennella Zell.,1995,7/22/95,1995-07-24,18
1132,LEPIDOPTERA,COLEOPHORIDAE,Coleophora lutipennella Zell.,1995,7/25/95,1995-07-27,13
1133,LEPIDOPTERA,COLEOPHORIDAE,Coleophora lutipennella Zell.,1995,7/28/95,1995-07-29,3
1134,LEPIDOPTERA,COLEOPHORIDAE,Coleophora lutipennella Zell.,1995,7/30/95,1995-07-30,17
1135,LEPIDOPTERA,COLEOPHORIDAE,Coleophora lutipennella Zell.,1995,7/31/95,1995-07-31,3
1136,LEPIDOPTERA,COLEOPHORIDAE,Coleophora lutipennella Zell.,1995,8/1/95,1995-08-01,2
1137,LEPIDOPTERA,COLEOPHORIDAE,Coleophora lutipennella Zell.,1995,8/2/95,1995-08-02,5
1138,LEPIDOPTERA,COLEOPHORIDAE,Coleophora lutipennella Zell.,1995,8/3/95,1995-08-03,2
1139,LEPIDOPTERA,COLEOPHORIDAE,Coleophora lutipennella Zell.,1995,8/4/95,1995-08-05,1
1140,LEPIDOPTERA,COLEOPHORIDAE,Coleophora lutipennella Zell.,1995,8/6/95,1995-08-06,1
1141,LEPIDOPTERA,COLEOPHORIDAE,Coleophora lutipennella Zell.,1996,7/5/96,1996-07-11,1
1142,LEPIDOPTERA,COLEOPHORIDAE,Coleophora lutipennella Zell.,1996,7/12/96,1996-07-17,11
1143,LEPIDOPTERA,COLEOPHORIDAE,Coleophora lutipennella Zell.,1996,7/18/96,1996-07-23,18
1144,LEPIDOPTERA,COLEOPHORIDAE,Coleophora lutipennella Zell.,1996,7/24/96,1996-07-25,7
1145,LEPIDOPTERA,COLEOPHORIDAE,Coleophora lutipennella Zell.,1996,7/26/96,1996-07-29,15
1146,LEPIDOPTERA,COLEOPHORIDAE,Coleophora lutipennella Zell.,1996,7/30/96,1996-08-01,16
1147,LEPIDOPTERA,COLEOPHORIDAE,Coleophora lutipennella Zell.,1996,8/2/96,1996-08-08,10
1148,LEPIDOPTERA,COLEOPHORIDAE,Coleophora lutipennella Zell.,1997,7/4/97,1997-07-06,7
1149,LEPIDOPTERA,COLEOPHORIDAE,Coleophora lutipennella Zell.,1997,7/7/97,1997-07-08,6
1150,LEPIDOPTERA,COLEOPHORIDAE,Coleophora lutipennella Zell.,1997,7/9/97,1997-07-10,14
1151,LEPIDOPTERA,COLEOPHORIDAE,Coleophora lutipennella Zell.,1997,7/11/97,1997-07-13,9
1152,LEPIDOPTERA,COLEOPHORIDAE,Coleophora lutipennella Zell.,1997,7/16/97,1997-07-20,8
1153,LEPIDOPTERA,COLEOPHORIDAE,Coleophora lutipennella Zell.,1997,7/21/97,1997-07-21,6
1154,LEPIDOPTERA,COLEOPHORIDAE,Coleophora lutipennella Zell.,1997,7/22/97,1997-07-23,9
1155,LEPIDOPTERA,COLEOPHORIDAE,Coleophora lutipennella Zell.,1997,7/25/97,1997-07-27,12
1156,LEPIDOPTERA,COLEOPHORIDAE,Coleophora lutipennella Zell.,1997,7/28/97,1997-07-31,16
1157,LEPIDOPTERA,COLEOPHORIDAE,Coleophora lutipennella Zell.,1997,8/1/97,1997-08-03,8
1158,LEPIDOPTERA,COLEOPHORIDAE,Coleophora lutipennella Zell.,1998,6/30/98,1998-07-02,2
1159,LEPIDOPTERA,COLEOPHORIDAE,Coleophora lutipennella Zell.,1998,7/9/98,1998-07-12,3
1160,LEPIDOPTERA,COLEOPHORIDAE,Coleophora lutipennella Zell.,1998,7/13/98,1998-07-19,7
1161,LEPIDOPTERA,COLEOPHORIDAE,Coleophora lutipennella Zell.,1998,7/20/98,1998-07-21,6
1162,LEPIDOPTERA,COLEOPHORIDAE,Coleophora lutipennella Zell.,1998,7/22/98,1998-07-23,12
1163,LEPIDOPTERA,COLEOPHORIDAE,Coleophora lutipennella Zell.,1998,7/24/98,1998-07-26,1
1164,LEPIDOPTERA,COLEOPHORIDAE,Coleophora lutipennella Zell.,1998,7/27/98,1998-07-28,5
1165,LEPIDOPTERA,COLEOPHORIDAE,Coleophora lutipennella Zell.,1998,7/29/98,1998-08-02,16
1166,LEPIDOPTERA,COLEOPHORIDAE,Coleophora lutipennella Zell.,1998,8/3/98,1998-08-04,1
1167,LEPIDOPTERA,COLEOPHORIDAE,Coleophora lutipennella Zell.,1998,8/7/98,1998-08-11,8
1168,LEPIDOPTERA,COLEOPHORIDAE,Coleophora lutipennella Zell.,1998,8/12/98,1998-08-13,5
1169,LEPIDOPTERA,COLEOPHORIDAE,Coleophora lutipennella Zell.,1998,8/14/98,1998-08-18,3
1170,LEPIDOPTERA,COLEOPHORIDAE,Coleophora lutipennella Zell.,1999,7/2/99,1999-07-04,2
1171,LEPIDOPTERA,COLEOPHORIDAE,Coleophora lutipennella Zell.,1999,7/5/99,1999-07-06,6
1172,LEPIDOPTERA,COLEOPHORIDAE,Coleophora lutipennella Zell.,1999,7/7/99,1999-07-08,20
1173,LEPIDOPTERA,COLEOPHORIDAE,Coleophora lutipennella Zell.,1999,7/9/99,1999-07-11,10
1174,LEPIDOPTERA,COLEOPHORIDAE,Coleophora lutipennella Zell.,1999,7/12/99,1999-07-19,16
1175,LEPIDOPTERA,COLEOPHORIDAE,Coleophora lutipennella Zell.,1999,7/20/99,1999-07-21,4
1176,LEPIDOPTERA,COLEOPHORIDAE,Coleophora lutipennella Zell.,1999,8/6/99,1999-08-08,2
1177,LEPIDOPTERA,COLEOPHORIDAE,Coleophora lutipennella Zell.,2000,6/16/00,2000-06-21,7
1178,LEPIDOPTERA,COLEOPHORIDAE,Coleophora lutipennella Zell.,2000,6/22/00,2000-06-27,16
1179,LEPIDOPTERA,COLEOPHORIDAE,Coleophora lutipennella Zell.,2000,6/28/00,2000-07-02,27
1180,LEPIDOPTERA,COLEOPHORIDAE,Coleophora lutipennella Zell.,2000,7/3/00,2000-07-06,37
1181,LEPIDOPTERA,COLEOPHORIDAE,Coleophora lutipennella Zell.,2000,7/7/00,2000-07-11,15
1182,LEPIDOPTERA,COLEOPHORIDAE,Coleophora lutipennella Zell.,2000,7/12/00,2000-07-18,39
1183,LEPIDOPTERA,COLEOPHORIDAE,Coleophora lutipennella Zell.,2000,7/19/00,2000-07-20,21
1184,LEPIDOPTERA,COLEOPHORIDAE,Coleophora lutipennella Zell.,2000,7/21/00,2000-07-24,60
1185,LEPIDOPTERA,COLEOPHORIDAE,Coleophora lutipennella Zell.,2000,7/25/00,2000-07-27,69
1186,LEPIDOPTERA,COLEOPHORIDAE,Coleophora lutipennella Zell.,2000,7/28/00,2000-07-30,28
1187,LEPIDOPTERA,COLEOPHORIDAE,Coleophora lutipennella Zell.,2000,7/31/00,2000-08-01,9
1188,LEPIDOPTERA,COLEOPHORIDAE,Coleophora lutipennella Zell.,2000,8/2/00,2000-08-03,3
1189,LEPIDOPTERA,COLEOPHORIDAE,Coleophora lutipennella Zell.,2000,8/4/00,2000-08-13,7
1190,LEPIDOPTERA,COLEOPHORIDAE,Coleophora lutipennella Zell.,2000,8/14/00,2000-08-20,3
1191,LEPIDOPTERA,COLEOPHORIDAE,Coleophora lutipennella Zell.,2001,7/2/01,2001-07-03,1
1192,LEPIDOPTERA,COLEOPHORIDAE,Coleophora lutipennella Zell.,2001,7/4/01,2001-07-08,15
1193,LEPIDOPTERA,COLEOPHORIDAE,Coleophora lutipennella Zell.,2001,7/9/01,2001-07-12,19
1194,LEPIDOPTERA,COLEOPHORIDAE,Coleophora lutipennella Zell.,2001,7/13/01,2001-07-16,13
1195,LEPIDOPTERA,COLEOPHORIDAE,Coleophora lutipennella Zell.,2001,7/17/01,2001-07-19,16
1196,LEPIDOPTERA,COLEOPHORIDAE,Coleophora lutipennella Zell.,2001,7/20/01,2001-07-23,42
1197,LEPIDOPTERA,COLEOPHORIDAE,Coleophora lutipennella Zell.,2001,7/24/01,2001-07-25,33
